timestamp,Username,Retweets,Text,Mentions,Hashtags
Wed Feb 19 15:52:56 +0000 2020,2735234547,0,Maybe we really don't even need the FISA court. Is the abuse and potential for even more and worse abuse from bad characters in the Federal government worth it ?,,
Wed Feb 19 15:52:56 +0000 2020,107410883,0,Amen,,
Wed Feb 19 15:52:55 +0000 2020,1217204061268738049,1,pic.twitter.com/REkxmIFCf9,,
Wed Feb 19 15:52:55 +0000 2020,17913668,0,"Saying he doesn’t know let’s him off too easy. While we would like to believe him to be, Trump isn’t stupid. He knows he can play to the lowest common denominator by lying in all caps. He makes up a story that suits his narrative, they believe it. GOP caves. The country suffers.",,
Wed Feb 19 15:52:55 +0000 2020,376943550,0,"Well, if you had clear evidence that he was framed would you have said that? You should have!",,
Wed Feb 19 15:52:55 +0000 2020,1175496903305367553,0,I don’t think it has anything to do with trump...,,
Wed Feb 19 15:52:54 +0000 2020,1169444208433778688,0,And the rest of us will lose,,
Wed Feb 19 15:52:54 +0000 2020,1898959045,0,"@SamanthaJPower, done an unmaskings lately?",@SamanthaJPower,
Wed Feb 19 15:52:54 +0000 2020,16029268,0,looks like the bar code that was on my QAnon t-shirt,,
Wed Feb 19 15:52:54 +0000 2020,1220129008655818753,0,"What a jerk! “I don’t even take a paycheck” pst! Thief, what else is new?",,
Wed Feb 19 15:52:54 +0000 2020,881363723582963712,0,Our Great President is going to Make America Great Again! RT @anantucketlady: RT @AZProducerLuke: Crowds continue to arrive for @realDonaldTrump #Phoenix rally. That includes @RealSheriffJoe who was pardoned by the Pr…,@anantucketlady @AZProducerLuke @realDonaldTrump @RealSheriffJoe,#Phoenix
Wed Feb 19 15:52:54 +0000 2020,3618841873,0,"scripts out if that office and there was Medicare , Mail and Wire fraud. Bad news . I wrote extensively about this at the time on @thedailybeast . I became jaded with Health Insurance , Obama and democrat politicians and Rmoney at that time. I can tell from your concern that ...",@thedailybeast,
Wed Feb 19 15:52:54 +0000 2020,16686670,0,Is that makes you feel complete? Having followers? So your whole purpose on this planet is to get people to like you. Kinda sad dude.,,
Wed Feb 19 15:52:53 +0000 2020,279296084,16,"#19Feb | Pdte. @NicolasMaduro: Donald Trump ha prometido aplastar y quebrar a Venezuela y a Pdvsa, ¿Quién va a poder más Donald Trump o la Clase Obrera Petrolera? Todo lo que hagamos en esta etapa, debe tener la marca y el sello del anti imperialismo #SoberaníaEnergéticapic.twitter.com/aEwLzl6Oma",@NicolasMaduro,#19Feb #SoberaníaEnergéticapic
Wed Feb 19 15:52:53 +0000 2020,946689566047481856,0,"As Pres. Trump said... He will take care of California, Chicago, etc...all major cities that have become sh.tholes...",,
Wed Feb 19 15:52:53 +0000 2020,1155980710148235264,0,Lol,,
Wed Feb 19 15:52:53 +0000 2020,1373391780,0,"It would be nice if you bought your own newspaper since it seems like the billionaire thing to do. Although I realize, probably not a great financial deal!",,
Wed Feb 19 15:52:52 +0000 2020,1062863821931462657,0,dont act like you care,,
Wed Feb 19 15:52:52 +0000 2020,1199083174325891072,0,thank god,,
Wed Feb 19 15:52:52 +0000 2020,467059872,0,"Whatever you say, Comrade.",,
Wed Feb 19 15:52:52 +0000 2020,1131939393722171392,0,Must read ... @realDonaldTrump https://twitter.com/alexsalvinews/status/1230277334227288064 …,@realDonaldTrump,
Wed Feb 19 15:52:52 +0000 2020,839312437954371584,0,I believe that @realDonaldTrump is a modern day prophet anointed by God and #QAnon is powered by God Himself. #QAnon #WWG1WGA,@realDonaldTrump,#QAnon #QAnon #WWG1WGA
Wed Feb 19 15:52:52 +0000 2020,144136909,0,@realDonaldTrump @vp @PressSec @KellyannePolls @LindseyGrahamSC @GOPLeader @SpeakerRyan @SenTomCotton @AIGkenham @SenTedCruz @Franklin_Graham @tperkins @kevinpswanson @BryanJFischer @DavidBartonWB @PastorJohnHagee @Paula_White @ralphdrollinger @GovMikeHuckabeehttps://twitter.com/jasonkarov/status/1230279027165925381 …,@realDonaldTrump @vp @PressSec @KellyannePolls @LindseyGrahamSC @GOPLeader @SpeakerRyan @SenTomCotton @AIGkenham @SenTedCruz @Franklin_Graham @tperkins @kevinpswanson @BryanJFischer @DavidBartonWB @PastorJohnHagee @Paula_White @ralphdrollinger @GovMikeHuckabeehttps,
Wed Feb 19 15:52:52 +0000 2020,583052721,0,"Yes, Everyone is with you, Bill Barr must be stopped Donald Trump and every person he has placed into our government must be investigated, especially Bill Barr, and his Daughter. Barr & Trump is destroying our government, he has punished the patriots, and promoted the scum.",,
Wed Feb 19 15:52:52 +0000 2020,973336282830114816,0,God bless President Donald J. Trump!,,
Wed Feb 19 15:52:51 +0000 2020,850771860031762433,0,"You are jealous because the man is really rich , not a fake like you , you said once ‘I am really rich ‘ fake news",,
Wed Feb 19 15:52:51 +0000 2020,3951516256,0,DON'T KNOW WHO THIS GUY IS.... BUT THE HUMILITY IS REFRESHING!!! @realDonaldTrump https://youtu.be/Yuw4nNJeuQ4,@realDonaldTrump,
Wed Feb 19 15:52:51 +0000 2020,1179601992504578048,0,"If it was at a Democrat rally, Libs would of punched him",,
Wed Feb 19 15:52:51 +0000 2020,19763032,0,This takes me back: https://www.youtube.com/watch?v=S_K1fo6BvEw … Watch a pro do it. Haydi abi! En güzel dansözcilik!,,
Wed Feb 19 15:52:51 +0000 2020,47156427,0,"Have a Snickers, dear. Been watching presidents for longer than you have, and this is not new.",,
Wed Feb 19 15:52:51 +0000 2020,718904023,1,trump rewards loyalists - destroys self-interested shitheads @realDonaldTrump has my full and complete loyalty ! i am absolutely *thrilled he *is *MY* President !,@realDonaldTrump,
Wed Feb 19 15:52:51 +0000 2020,788057124295376896,2,"Hold tight, there are 5 more years. If you don't like it, that means President Trump has made the right decision.",,
Wed Feb 19 15:52:51 +0000 2020,3097036170,1,Y’all are gonna have to check that hill for chlamydia now that Trump is on it.,,
Wed Feb 19 15:52:50 +0000 2020,16585101,0,*for,,
Wed Feb 19 15:52:50 +0000 2020,1003682733745291264,1,Auto bailout was repaid. Farm bailout won't ever be repaid.,,
Wed Feb 19 15:52:50 +0000 2020,1102400054,0,"ThIs quote applies to Trump presidency to a T. He tweets, talks or monitor but rarely fulfills his promises? We still have no WALL,Obamacare not repeal nor replaced,Mexican cartel designation or the most important immigration overhaul & many more.Also Fannie&Freddie debacle.",,
Wed Feb 19 15:52:50 +0000 2020,1434240264,1,I am so sorry for your loss.,,
Wed Feb 19 15:52:50 +0000 2020,251898959,0,Only because Trump bailed them out after his tariffs destroyed their businesses.,,
Wed Feb 19 15:52:49 +0000 2020,126145029,5,"Vote against him. Talk about the many ways he has done harm to families all over the entire planet !! Think about it ! Do not be afraid of telling people that you are voting against Donald Trump, Gangster in residence at the White House. https://twitter.com/TheRealDWoo/status/1229997800118767616 …",,
Wed Feb 19 15:52:49 +0000 2020,799417220195565568,0,pic.twitter.com/2FuKeJgWcI,,
Wed Feb 19 15:52:49 +0000 2020,2824023766,0,As I said the media can Make Pope look bad. He definitely isn't any worse than most of them. He's not a politician so he doesn't pull any punches in his talk. I will continue to argue that the media and Democratic party go out of the way to spread false information...,,
Wed Feb 19 15:52:49 +0000 2020,3681334037,0,"But will the voter rolls be purged and will we force ID to be shown? If not, something tells me #dirtydems will “claim” victory and we will go through a recount and yet another scandal. Please fix these issues prior to Nov. #VoterID #IceAtPolls #paperballots #KAG2020",,#dirtydems #VoterID #IceAtPolls #paperballots #KAG2020
Wed Feb 19 15:52:49 +0000 2020,416908645,33,“We have the highest Poll numbers that we have EVER had. Thank you Nancy very much” President Donald Trump #KAG2020 #TrumpRallyPhoenix TONIGHTpic.twitter.com/DQsV6BW4mi,,#KAG2020 #TrumpRallyPhoenix
Wed Feb 19 15:52:49 +0000 2020,498379280,0,"Shortly after @realdonaldtrump was inaugurated, Julian Assange had his attorney ask him for a pardon. You never heard anything more about it. Trump might have come back with the offer of #TitForTat and Assange said no because his whole reason for existence is to tell the TRUTH.",@realdonaldtrump,#TitForTat
Wed Feb 19 15:52:49 +0000 2020,917266106582216705,1,#PeeOnMeChelsea obviously has a problem with @realDonaldTrump pardoning people of color. #LiberalRacist @chelseapic.twitter.com/5bseu8TfnP,@realDonaldTrump @chelseapic,#PeeOnMeChelsea #LiberalRacist
Wed Feb 19 15:52:49 +0000 2020,16071190,0,"Yes...and criminal @realDonaldTrump did it! He apparently starts tomorrow! It is up to us, the people of this country, to remove this horrible crook from office as fast as possible! Same with @senatemajldr who will do everything he can to bribe and cheat! Be relentless!",@realDonaldTrump @senatemajldr,
Wed Feb 19 15:52:48 +0000 2020,286618879,0,@realDonaldTrump will Reagan the 2020! pic.twitter.com/8psNa7jY5H,@realDonaldTrump,
Wed Feb 19 15:52:48 +0000 2020,247149179,0,He probably forgot to contribute to @realDonaldTrump campaign,@realDonaldTrump,
Wed Feb 19 15:52:48 +0000 2020,1426304065,0,Does he turn into a turd blossom?,,
Wed Feb 19 15:52:48 +0000 2020,1217204061268738049,2,pic.twitter.com/jwD6gXxrs5,,
Wed Feb 19 15:52:48 +0000 2020,20487617,0,"What do you have against gays, homophobe?",,
Wed Feb 19 15:52:48 +0000 2020,782699913679372289,0,What an inside into a real stable genius‘ mind.,,
Wed Feb 19 15:52:48 +0000 2020,1217096530722582529,0,pic.twitter.com/2cKh9HABZs,,
Wed Feb 19 15:52:48 +0000 2020,1225152687798472704,0,@jasonguess8 ifb at twitters pace,@jasonguess8,
Wed Feb 19 15:52:48 +0000 2020,260642484,0,"That’s what @realDonaldTrump does, breaks with precedence. We are not safe or secure with him in office.",@realDonaldTrump,
Wed Feb 19 15:52:47 +0000 2020,1061696946405040129,0,24% increase in farms failing in. 2019 !!!! The increase is the big farms taking out the little guy ...,,
Wed Feb 19 15:52:47 +0000 2020,1019363120098275328,0,Q people bully no one. But your disinformation exposes who you are.,,
Wed Feb 19 15:52:47 +0000 2020,480525449,0,Also Blago: I’m a political prisone r!! @StephenAtHome @Trevornoah @maddow @JoyVBehar @TheView @andersoncooper @jaketapper @Suntimes,@StephenAtHome @Trevornoah @maddow @JoyVBehar @TheView @andersoncooper @jaketapper @Suntimes,
Wed Feb 19 15:52:47 +0000 2020,852621386728321024,0,Ah yes. Because the self proclaimed ‘woman of colour’ was involved. What does racism have to do with a mob?,,
Wed Feb 19 15:52:47 +0000 2020,3095689252,0,#USA #WW2 #Veterans #TrumpRally #TrumpRallyPhoenix #Trump2020 @realDonaldTrump #GodBlessAmericahttps://twitter.com/w_terrence/status/1230275727083347969 …,@realDonaldTrump,#USA #WW2 #Veterans #TrumpRally #TrumpRallyPhoenix #Trump2020 #GodBlessAmericahttps
Wed Feb 19 15:52:47 +0000 2020,501835093,0,@LBosmenierPMC,@LBosmenierPMC,
Wed Feb 19 15:52:47 +0000 2020,764981766562148352,0,"Franklin no pierda tiempo, montero solo se esta arrastrando por un trabajo en telesur",,
Wed Feb 19 15:52:46 +0000 2020,1223370541958074368,0,Fine the employers of illegals one thousand a day then see the illegals in the streets ribbing n hurting oeople but the rich are harbouring the illegals,,
Wed Feb 19 15:52:46 +0000 2020,28631969,0,All Trumps fault,,
Wed Feb 19 15:52:46 +0000 2020,1032268269607178240,0,"“El socialismo es una idea triste y desacreditada, arraigada en la ignorancia total de la historia y la naturaleza humana” @realDonaldTrump #LIBERTAD pic.twitter.com/1JOe4CGdxf",@realDonaldTrump,#LIBERTAD
Wed Feb 19 15:52:45 +0000 2020,1140423562412662785,0,"Would you call that a peaceful assembly of freedom of speech by the students.Lets exercise some intelligence, shall we ? God Bless America and our Constitution ....freedom of speech and the right to bare arms !",,
Wed Feb 19 15:52:45 +0000 2020,1207871417620082688,0,"Whine, apparently. #VoteBlueNoMatterWho2020pic.twitter.com/7bXqITTE0j",,#VoteBlueNoMatterWho2020pic
Wed Feb 19 15:52:45 +0000 2020,1226829492011913216,0,"I feel honored that all you of you left wing,TDS suffering child molesters hate me so much. I feel like the great President Donald J Trump. Best President ever.",,
Wed Feb 19 15:52:45 +0000 2020,33149248,0,"Right. He didn't sell it. He just tried to sell it, or trade it, or somehow enrich himself from the opportunity. The fact that he failed at that attempt makes it all ok though, right?",,
Wed Feb 19 15:52:45 +0000 2020,1017442893890453505,0,FREE ROSS ULBRICHT NOW @realDonaldTrump !!! @charliekirk11 please help us! We are SO close now!,@realDonaldTrump @charliekirk11,
Wed Feb 19 15:52:45 +0000 2020,1220132465362325504,0,You're just being homophobic now,,
Wed Feb 19 15:52:44 +0000 2020,881363723582963712,0,Our Great President is going to Make America Great Again! RT @bobbyhochu: RT @TeamTrump: Net farm income plummeted by 20% under Obama. Under @realDonaldTrump it has increased by over 50%! #FarmersForTrump https:…,@bobbyhochu @TeamTrump @realDonaldTrump,#FarmersForTrump
Wed Feb 19 15:52:44 +0000 2020,1107776736761008129,0,I’m happy for my taxes to pay to educate Floridians like you .pic.twitter.com/FrBQXK4PVy,,
Wed Feb 19 15:52:43 +0000 2020,1630935031,0,,,
Wed Feb 19 15:52:42 +0000 2020,439582400,0,pic.twitter.com/nYPsxYphml,,
Wed Feb 19 15:52:42 +0000 2020,21411241,2,Is this about toilet flushing again?pic.twitter.com/bgHwN6wiTh,,
Wed Feb 19 15:52:42 +0000 2020,2696615395,0,I’m sure you will be meeting the DOJ and you better bring a good lawyer. Durham could even knock on your door. Storm is starting. No one will escape justice.,,
Wed Feb 19 15:52:41 +0000 2020,2937755893,0,@realDonaldTrump best president ever.,@realDonaldTrump,
Wed Feb 19 15:52:40 +0000 2020,47574839,0,Great let’s see one on one debate Don v Mike,,
Wed Feb 19 15:52:40 +0000 2020,1088425843095941120,2,The plot continues,,
Wed Feb 19 15:52:40 +0000 2020,1230186376198488064,0,#RedNation,,#RedNation
Wed Feb 19 15:52:40 +0000 2020,1145798310172790784,0,That's what America is about. Honor those who sacrifice so much. Thank you President Trump! @realDonaldTrump https://twitter.com/DonaldJTrumpJr/status/1230269630318444544 …,@realDonaldTrump,
Wed Feb 19 15:52:40 +0000 2020,1046892631916077056,0,"So excellent, Water Rights are life or death to Farmers and Miners; God bless @realDonaldTrump for his work restoring rights to the people and states. Praise God for new tech and methods so water is cleaner than ever before. The best is yet to come! https://twitter.com/Goldstatetimes/status/1230248120736305153 …",@realDonaldTrump,
Wed Feb 19 15:52:40 +0000 2020,798602418665783296,2,He’s phenomenal!,,
Wed Feb 19 15:52:40 +0000 2020,1146424664211775488,0,Is that a WWG1WGA shirt ? AND A Qt patch?,,
Wed Feb 19 15:52:40 +0000 2020,796191410,0,Didn't you spy on innocent Americans? Your opinion on the rule of law in America is worthless.,,
Wed Feb 19 15:52:39 +0000 2020,1213438995759108096,0,Just get rid of all the liberals and we’ll be fine!,,
Wed Feb 19 15:52:39 +0000 2020,23098398,0,I love my fellow American patriots! From a Proud Deplorable in Portland! I will be cheering from my living room with all of you at the rally!,,
Wed Feb 19 15:52:39 +0000 2020,809395476894203904,0,"If #JulianAssange is telling the truth here, which I suspect he is, @realDonaldTrump has engaged in #Treason. Time to dog walk his ass.. #BlueTsunami2020 #CarnivalBarkingClown #ImpeachTrumpAgain",@realDonaldTrump,#JulianAssange #Treason #BlueTsunami2020 #CarnivalBarkingClown #ImpeachTrumpAgain
Wed Feb 19 15:52:39 +0000 2020,19361329,0,"I don't think they've shared a bed for years. Although, thanks for the horrible visual that my brain cannot unsee.",,
Wed Feb 19 15:52:39 +0000 2020,2708733717,7,How many did you unmask?,,
Wed Feb 19 15:52:39 +0000 2020,1228718361841950722,1,pic.twitter.com/k1nx3QUzuO,,
Wed Feb 19 15:52:39 +0000 2020,2898804738,0,Truth! One said we have done all we can do -there ain't no magic wand. The other one found that dang wand!!!!! God Bless Donald J. Trump!! Don't tell him he can 't do something. He'll do the impossible anyway. (MAJ) https://twitter.com/LizRNC/status/1230154976221179904 …,,
Wed Feb 19 15:52:38 +0000 2020,1046242446,0,"He was convicted by a jury of his peers...... he’s GUITY of corruption, but, the fits right in with the Corruptor in Chief, @realDonaldTrump, MR. IMPEACHMENT.",@realDonaldTrump,
Wed Feb 19 15:52:38 +0000 2020,942736087482499079,0,Yay socialism!,,
Wed Feb 19 15:52:38 +0000 2020,870469610625089536,0,@realDonaldTrump @DonaldJTrumpJrhttps://twitter.com/DonaldJTrumpJr/status/1230269630318444544 …,@realDonaldTrump @DonaldJTrumpJrhttps,
Wed Feb 19 15:52:38 +0000 2020,837545137253171200,0,Where did the 97% approval rating go? I thought you were doing so well! Oh.. wait.. People are realizing you're garbage mate. We'll see where those approval ratings are come November. I'm sure you wont be so happy then.,,
Wed Feb 19 15:52:38 +0000 2020,21758784,4,THIS IS WHAT BEING A PATRIOT TO OUR COUNTRY IS ALL ABOUT. GOD BLESS THAT WWII VETERAN AND THOSE WHO HELPED HIM.,,
Wed Feb 19 15:52:38 +0000 2020,363210932,0,"Well he is...and still your president Reuter's boy...why don't you go cover in depth the cow's antiburp mask story?... who knows, you might land a job at the UN",,
Wed Feb 19 15:52:38 +0000 2020,965986685547958274,0,Trump supporters.,,
Wed Feb 19 15:52:38 +0000 2020,880255891781468160,0,I'm here for the lolz,,
Wed Feb 19 15:52:38 +0000 2020,616875188,0,"Senator you were beating Donald Trump in every poll for LARGE margins back in 2015/16 and you’re beating Donald Trump by even LARGER margins and the only candidate beating Donald Trump in polls now. Corporate MSM’s, #NeverBernie #StopSanders smears just have us donating more",,#NeverBernie #StopSanders
Wed Feb 19 15:52:37 +0000 2020,49037478,0,Then he’d actually BE a billionaire instead of playing one on television.,,
Wed Feb 19 15:52:37 +0000 2020,3234321342,0,@realDonaldTrump you want to be chief legal officer? prosecute this pile of crap! https://twitter.com/charliekirk11/status/1230202434456174592 …,@realDonaldTrump,
Wed Feb 19 15:52:37 +0000 2020,1178858149551509504,0,Julian said this or his lawyer allegedly said this. Altering the story I see.,,
Wed Feb 19 15:52:37 +0000 2020,630381470,4,@realDonaldTrump @MickMulvaneyOMB #Stupid #TrumpisaMoron #LiarinChief #GOPTaxScam #TaxCuts4Rich #FederalDeficit #Trillionpic.twitter.com/c1HacvKZ4Z,@realDonaldTrump @MickMulvaneyOMB,#Stupid #TrumpisaMoron #LiarinChief #GOPTaxScam #TaxCuts4Rich #FederalDeficit #Trillionpic
Wed Feb 19 15:52:37 +0000 2020,1224033335929921538,0,Trump's working on it.,,
Wed Feb 19 15:52:37 +0000 2020,732973489280421888,2,Donald Trumps response-Neil who ?,,
Wed Feb 19 15:52:37 +0000 2020,1021511338265260032,0,I hear that a lot. @Kansasgirl1 Just means Im over the . Thanks for any likes and re-likes.,@Kansasgirl1,
Wed Feb 19 15:52:36 +0000 2020,912065709756346368,0,WHAT ABOUT ALL THE DAMAGE YOU AND THE OBAMA ADMINISTATION DID TO OUR COUNTRY???? CARE TO TALK ABOUT THAT????????,,
Wed Feb 19 15:52:36 +0000 2020,17170308,0,pic.twitter.com/zHgfxNVNVf,,
Wed Feb 19 15:52:36 +0000 2020,1472646570,0,"He wasn’t convicted of selling the seat. He was convicted of attempting to sell the Senate seat. Geez, for being America’s “top law enforcement officer” you really have a terrible understanding of laws! #IMPOTUS",,#IMPOTUS
Wed Feb 19 15:52:36 +0000 2020,872103733261254656,2,#WWG1WGA,,#WWG1WGA
Wed Feb 19 15:52:36 +0000 2020,1056254731495137281,0,pic.twitter.com/ezgoIWppl3,,
Wed Feb 19 15:52:36 +0000 2020,1014307863257214977,0,pic.twitter.com/ZSItIykLbt,,
Wed Feb 19 15:52:35 +0000 2020,701342546,0,,,
Wed Feb 19 15:52:35 +0000 2020,751337247597666304,0,The law said otherwise. Not like you ever follow the law. Keep DESTROYING America. We will #RememberInNovember #RuleOfLawpic.twitter.com/wWOzuuwspc,,#RememberInNovember #RuleOfLawpic
Wed Feb 19 15:52:35 +0000 2020,952365908118458368,0,Agreed! The intelligence community of this country has been completely smeared. I believe this man can be the change that is desperately needed. #DrainTheSwamp,,#DrainTheSwamp
Wed Feb 19 15:52:34 +0000 2020,1157425814364778496,0,@realDonaldTrump @MikeBloomberg y’all are both fucking children. Figure it out and do better. America is watching.pic.twitter.com/mL2FPE64C9,@realDonaldTrump @MikeBloomberg,
Wed Feb 19 15:52:34 +0000 2020,155769879,0,"Who’s paying for all these rallies? I hope it’s his campaign and not the taxpayers. And why are we paying for Sanders, Warren, & Klobuchar to campaign?",,
Wed Feb 19 15:52:34 +0000 2020,3290879953,0,"OIC. I should've done my research before I engaged. Its #TDS @JustinJayF no cure! It must suck for you in this great conservative country. seriously though...turn off the game,open a window and step out of the basement. Your #POTUS is @realDonaldTrump #MAGA #KeepAmericaGreat",@JustinJayF @realDonaldTrump,#TDS #POTUS #MAGA #KeepAmericaGreat
Wed Feb 19 15:52:34 +0000 2020,1191093959969386498,0,@realDonaldTrump pic.twitter.com/SRjuj5ze7D,@realDonaldTrump,
Wed Feb 19 15:52:34 +0000 2020,128990678,0,Funny... that’s all you.,,
Wed Feb 19 15:52:33 +0000 2020,1131335545970450437,0,You say as you bring literally nothing to the discussion for anyonepic.twitter.com/1a1CtLsCQR,,
Wed Feb 19 15:52:33 +0000 2020,81438375,0,"You will never defeat him, your record in New York doesnt compare to what he has accomplished",,
Wed Feb 19 15:52:33 +0000 2020,2426146308,0,"""Internal polls""...so numbers you just pull out of your ass, right?",,
Wed Feb 19 15:52:33 +0000 2020,772224008083283968,0,Pence would agree.,,
Wed Feb 19 15:52:33 +0000 2020,1077017515761508352,0,If @theDemocrats can not take down @realDonaldTrump or his staff / donors. Now they are targeting his supporters. #WeWillFightBack #ProudDeplorable #TNM http://b8c9x.j7k.info @tnmorg,@theDemocrats @realDonaldTrump @tnmorg,#WeWillFightBack #ProudDeplorable #TNM
Wed Feb 19 15:52:33 +0000 2020,45641358,1,"President Donald Trump is expected to name US Ambassador to Germany, Richard Grenell, a Palm Srpings resident, and openly gay member of the Trump Administration, as the next acting director of national intelligence. #Winning #Trump2020",,#Winning #Trump2020
Wed Feb 19 15:52:32 +0000 2020,848510610,0,Cheaters never win. Thats why Trump will win again and you Demoncrats will lose again #Trump2020Landslide,,#Trump2020Landslide
Wed Feb 19 15:52:32 +0000 2020,2797871110,0,Farmers are on ‘food stamps’ under trump.,,
Wed Feb 19 15:52:32 +0000 2020,54792870,0,Had to leave quickly bc he didn't tell his mom he was borrowing her car.,,
Wed Feb 19 15:52:32 +0000 2020,29177743,39,pic.twitter.com/tuiiWey4x8,,
Wed Feb 19 15:52:32 +0000 2020,999110188501295104,0,"Your home state, mine too, and my home city of Chicago have been systematically picked apart for sellable parts for 75 years by Democrats, and now its crumbling under its own weight. He won’t pardon Madigan, don’t worry.",,
Wed Feb 19 15:52:32 +0000 2020,144136909,0,"Fea explained that the Age of Trump is a continuation of a long history in America where too many white Christians have supported racism, nativism and other regressive social causes..https://www.rawstory.com/2020/02/trumps-christians-evangelical-historian-explains-how-right-wingers-are-able-to-ignore-jesus-to-embrace-racism-and-support-the-president/ …",,
Wed Feb 19 15:52:32 +0000 2020,1087811923205185536,520,President Trump achieves the winning bid for the 2028 Olympic Games! Thank you Mr. President! @realDonaldTrump @2028olympics Give me a RT of you think this is awesome!! President Trump confirms government will assist L.A. during 2028 Olympics https://www.latimes.com/sports/olympics/story/2020-02-18/president-trump-2028-olympics-la-los-angeles …,@realDonaldTrump @2028olympics,
Wed Feb 19 15:52:32 +0000 2020,440041527,0,Doesn't matter what your friends do long as they're democrats. If it were REPUBLICANS doing the same you'd be in agreement with the president . Try being honest.,,
Wed Feb 19 15:52:31 +0000 2020,1185273279956652032,0,"Joe Biden doesn’t need to testify, he’s already on video bragging about threatening to hold billions from the Ukraine if the prosecutor wasn’t fired. Isn’t that video testimony? Impeachment theater!! Fake out QUID PRO QUO JOE IS the real reason for the impeachment! Distraction!",,
Wed Feb 19 15:52:31 +0000 2020,1038475633918177281,2,"#TrumpRallyPhoenix #Trump2020 This Arizonan didn’t vote for @realDonaldTrump in 2016, but he says President Trump’s accomplishments have “definitely” earned his vote in November! pic.twitter.com/DT169b3xDB",@realDonaldTrump,#TrumpRallyPhoenix #Trump2020
Wed Feb 19 15:52:30 +0000 2020,815746077412491265,0,This is the brilliant insight I was looking for. Keep up the great work.,,
Wed Feb 19 15:52:30 +0000 2020,1247936395,0,"Yes, he needs to spill much more than pandering texts.",,
Wed Feb 19 15:52:30 +0000 2020,594763427,0,"wow really owning Bernie Sanders by confirming that Bloomberg does in fact own a multi-million dollar condo on the property of his friend, Donald Trump doing a bang up job here",,
Wed Feb 19 15:52:30 +0000 2020,785484573798899712,0,Hes out of his lane.,,
Wed Feb 19 15:52:29 +0000 2020,259256350,0,"el mismo día que Bolívar, Washington, etc., ganaron sus elecciones con el CNE chavista...pic.twitter.com/nYpdBiA0kV",,
