timestamp,Username,Retweets,Text,Mentions,Hashtags
Wed Feb 19 15:49:39 +0000 2020,582462990,1,Briberyhttps://www.latimes.com/politics/story/2019-11-27/trump-dispenses-billions-aid-to-farmers-shore-up-rural-base …,,
Wed Feb 19 15:49:39 +0000 2020,380080417,1,I love how not a single thing you presented here is true.,,
Wed Feb 19 15:49:39 +0000 2020,4858027035,0,Now that's how we take care of our own,,
Wed Feb 19 15:49:39 +0000 2020,824789569677697024,2,fact-based institutions? HaHaHaHaHaHaHaHaHaHaHaHaHaHaHaHaHaHaHaHa! Name one “fact-based institutions” that @realDonaldTrump has destroyed or forever prove you are a fool. https://twitter.com/SamanthaJPower/status/1230273977815355395 …,@realDonaldTrump,
Wed Feb 19 15:49:39 +0000 2020,3888462380,0,"I’m genuinely curious if there have been a ton of incidents? There have been 100’s on the left that I know about, just from Antifa alone. There is no violent group of conservatives traveling around and regularly attacking people, that I know of",,
Wed Feb 19 15:49:39 +0000 2020,970543655269388288,0,Donald Trump Claims 7 Million Will Welcome Him In Ahmedabad. Twitter Cracks Up #SmartNewshttps://www.ndtv.com/india-news/donald-trump-trolled-for-claiming-80-of-ahmedabad-will-line-up-for-him-2182645 …,,#SmartNewshttps
Wed Feb 19 15:49:39 +0000 2020,747716678432198657,0,Facts... yeah right.,,
Wed Feb 19 15:49:38 +0000 2020,539142666,0,"He promised much, delivered little, took all. Sound familiar?pic.twitter.com/1DGBMJgNOQ",,
Wed Feb 19 15:49:37 +0000 2020,1013852959082450945,0,"Actually, Trump has bankrupted them. But no worries right?",,
Wed Feb 19 15:49:37 +0000 2020,59405716,0,@realDonaldTrump STOP TWEETING! You cannot possibly tweet 24/7 like you do AND do your job as @Potus! Get back to work! #MAGA,@realDonaldTrump @Potus,#MAGA
Wed Feb 19 15:49:37 +0000 2020,965657830295420928,0,"Haha you think the ""tariff money"" is being given to the farmers? Even if it were, that would still be ""socialism"" by Republican standards. I'm so sorry. And btw, those ""issues"" are customers that are now gone forever.",,
Wed Feb 19 15:49:37 +0000 2020,2480874854,0,You must really want Bernie to win the primary. Scared of everyone else?,,
Wed Feb 19 15:49:37 +0000 2020,2238532361,0,He stole nothing.,,
Wed Feb 19 15:49:37 +0000 2020,25956756,0,Keep communicating with @realDonaldTrump #LeadRight @parscale @VickieBlum @Oregon_GOP @SomethingsNotR3 @peabodyfmdev @realDonaldTrump @ispyradiopic.twitter.com/Q6H6KRu1Gu,@realDonaldTrump @parscale @VickieBlum @Oregon_GOP @SomethingsNotR3 @peabodyfmdev @realDonaldTrump @ispyradiopic,#LeadRight
Wed Feb 19 15:49:37 +0000 2020,1172030497070804993,0,"If there is something that YOU don’t like about @realdonaldtrump or Republicans, use YOUR words to voice your opinion. Spewing hate will get you nowhere, but likely will get you a few snarky tweet responses. #trump2020",@realdonaldtrump,#trump2020
Wed Feb 19 15:49:36 +0000 2020,1201255758278598656,0,Hope you lose every single cat you have..meow meow...,,
Wed Feb 19 15:49:36 +0000 2020,2898443876,0,"And that's why #MSDNC is trying to cripple #BernieSanders2020 . Because they work for @comcastcares (ha ha ha), a cynical right-wing corporation that has gotten everything it ever wanted from Donald Trump. #netneutrality",@comcastcares,#MSDNC #BernieSanders2020 #netneutrality
Wed Feb 19 15:49:36 +0000 2020,1088425843095941120,0,"Don’t they have police? If not, put the bum in a bag and drop him off in the Desert!",,
Wed Feb 19 15:49:36 +0000 2020,1000186237347561472,0,Amazing! Everything you just said is false. How are you a Professor?,,
Wed Feb 19 15:49:36 +0000 2020,2565747746,0,Your all going to be exposed pic.twitter.com/hwiuJBaelz,,
Wed Feb 19 15:49:36 +0000 2020,2202241436,1,"Simply put, you’re jealous",,
Wed Feb 19 15:49:36 +0000 2020,74349824,0,"Now I'm a baby? Okay, blue cookie cutter resistance. Democracy is still winning despite your attempt to undermine it.",,
Wed Feb 19 15:49:35 +0000 2020,2240103253,0,"Lee, the very structure of your nation is at risk from trump’a actions. What is wrong with you. You should be defending your country and constitution as earnestly as the concerned democrats. Disgraceful. Coward.",,
Wed Feb 19 15:49:35 +0000 2020,36706851,0,Strike one: America lost when Putin’s Puppet was put in the WH. Strike two: mueller confirmed that Trump was not only not exonerated but was elected with Russian interference. Strike three: Patriotic Americans impeached Traitor Trump & Russian-owned GOP gave up America.,,
Wed Feb 19 15:49:35 +0000 2020,624015457,0,Still impeached!,,
Wed Feb 19 15:49:35 +0000 2020,14529444,0,Yesterday we were pansies who hate guns. WHICH IS IT?,,
Wed Feb 19 15:49:35 +0000 2020,1157740333406609408,2,While military kids scrape by with inadequate space at school.,,
Wed Feb 19 15:49:34 +0000 2020,952925695453274113,0,No one escapes this. No one.,,
Wed Feb 19 15:49:34 +0000 2020,1085388317703720966,1,#Deplorables Being #Patriots At #TrumpRallyPhoenix Awesome~!! @seanhannity @PressSec @realDonaldTrump @IngrahamAngle #KAG2020 Spread The Love~!!https://twitter.com/w_terrence/status/1230275727083347969 …,@seanhannity @PressSec @realDonaldTrump @IngrahamAngle,#Deplorables #Patriots #TrumpRallyPhoenix #KAG2020
Wed Feb 19 15:49:34 +0000 2020,1186662692708327425,0,pic.twitter.com/jR6FEwupFs,,
Wed Feb 19 15:49:33 +0000 2020,3282585122,0,@POTUS @realDonaldTrump https://twitter.com/linda94861521/status/1230221667739349000 …,@POTUS @realDonaldTrump,
Wed Feb 19 15:49:33 +0000 2020,587161742,0,Oyeeee tsss tsss...pic.twitter.com/e3S31pm1L0,,
Wed Feb 19 15:49:33 +0000 2020,302676601,0,The blaze?!pic.twitter.com/Os1qf7sN2D,,
Wed Feb 19 15:49:33 +0000 2020,78477882,0,"@MikeBloomberg @realDonaldTrump DOES NOT FEAR YOU .....The American People DO...You ARE dangerous, You ARE a LIAR, You ARE a CRIMINAL #TRUMP2020 #DemocratsAreDestroyingAmerica #DemocratsWillDestroyFreedoms #KAG2020 #VoteRedToSaveAmerica",@MikeBloomberg @realDonaldTrump,#TRUMP2020 #DemocratsAreDestroyingAmerica #DemocratsWillDestroyFreedoms #KAG2020 #VoteRedToSaveAmerica
Wed Feb 19 15:49:33 +0000 2020,1364713170,0,Did jeff teach you this grooming technique?,,
Wed Feb 19 15:49:33 +0000 2020,1151933221430603776,0,I hear you...isn't it great?!!!,,
Wed Feb 19 15:49:33 +0000 2020,815026773716963328,0,"Yes, he did.",,
Wed Feb 19 15:49:32 +0000 2020,1217253563191189504,0,Where is the footage of Bernie with the Clintons? Donald Trump? Jeffrey Epstein? How many times has he changed his political party? What about footage of him contradicting himself? lying? racist comments? I have only seen footage of him saying the same things he says today.,,
Wed Feb 19 15:49:32 +0000 2020,1395590664,0,Could not agree more -,,
Wed Feb 19 15:49:32 +0000 2020,515971672,0,So she's answering protesting with violence? Just like these @realDonaldTrump thugs. Kent State 'gun girl' vows return to Ohio University with 'army of gun owners' after protest #Topbuzzhttp://va.topbuzz.com/s/RsckYM,@realDonaldTrump,#Topbuzzhttp
Wed Feb 19 15:49:32 +0000 2020,785749473947365376,0,"""Russia pays 2 people, I swear to God, @realDonaldTrump and Rohrabacher""",@realDonaldTrump,
Wed Feb 19 15:49:32 +0000 2020,1213875564458569733,0,Your not half of the People.,,
Wed Feb 19 15:49:31 +0000 2020,780963903719088128,0,Warped. Illegal is ILLEGAL !,,
Wed Feb 19 15:49:31 +0000 2020,507866152,0,The farmers have been getting bail out for over a hundred years. You are a special kind of stupid Please study,,
Wed Feb 19 15:49:31 +0000 2020,405956626,0,,,
Wed Feb 19 15:49:31 +0000 2020,1195421366222127105,0,"I know this is twitter, but you need to be clear about which which is which. Read your post again.",,
Wed Feb 19 15:49:31 +0000 2020,1042570771946721280,27,pic.twitter.com/4StRXJeWuZ,,
Wed Feb 19 15:49:31 +0000 2020,334228157,0,True Americans coming together to get it done,,
Wed Feb 19 15:49:30 +0000 2020,2507014077,0,https://www.politifact.com/factchecks/2019/mar/26/joe-biden/trump-medicare-budget-cuts-billion/ …,,
Wed Feb 19 15:49:30 +0000 2020,1179014460654182400,0,Law & order is gone in California!!,,
Wed Feb 19 15:49:30 +0000 2020,1193721155166838784,0,Lol. He knows why he immigrated in USA. Bc of ppl like @realDonaldTrump,@realDonaldTrump,
Wed Feb 19 15:49:29 +0000 2020,823612067420708864,0,Does Trump really eat THAT much?????,,
Wed Feb 19 15:49:29 +0000 2020,940966432707366912,0,How much of that income was federal aid due to your absurd trade war?,,
Wed Feb 19 15:49:29 +0000 2020,141830517,0,President of the United States Donald J. Trump has been President longer than you former Vice President Joe Biden.,,
Wed Feb 19 15:49:29 +0000 2020,1207035755207569408,1,Fraud farting sounds,,
Wed Feb 19 15:49:29 +0000 2020,870268209814880256,0,Tick Tock Worried much ?,,
Wed Feb 19 15:49:29 +0000 2020,1218350349238579200,0,Are you republicans scared of liquid? Is that too violent for you while carrying guns around?! #POOPINGFORKAITLIN,,#POOPINGFORKAITLIN
Wed Feb 19 15:49:29 +0000 2020,3689779702,0,Bless his heart! He wanted to go to the Trump Rally. He needs a MAGA hat :) #realDonaldTrump,,#realDonaldTrump
Wed Feb 19 15:49:29 +0000 2020,3450481586,0,Wouldn't that be a state case?,,
Wed Feb 19 15:49:28 +0000 2020,331775975,0,Blago should be concerned with who freed him. #ETTD,,#ETTD
Wed Feb 19 15:49:28 +0000 2020,52305347,0,Was William Barr there? @StateDept @DOJPH @ABAesq,@StateDept @DOJPH @ABAesq,
Wed Feb 19 15:49:28 +0000 2020,900808781789102080,0,Y'all have a great time!,,
Wed Feb 19 15:49:28 +0000 2020,926949410738769920,0,"LIES!!! ALL LIES!!! May God have mercy on these LIARS. KJV Chapter Revelations chapter 21 verse 8 ...and all liars, shall have their part in the lake which burneth with fire and brimstone: which is the second death.We love our honest @realDonaldTrump, @LouDobbs and @seanhannityhttps://twitter.com/SkyNews/status/1230193529114243073 …",@realDonaldTrump @LouDobbs @seanhannityhttps,
Wed Feb 19 15:49:28 +0000 2020,395084821,0,"Thanks for confirming @realDonaldTrump choice, Richard Grendell, for Acting Head of Intelligence to be a great one! #KAG #MAGA #WWG1WGAhttps://twitter.com/SamanthaJPower/status/1230273977815355395 …",@realDonaldTrump,#KAG #MAGA #WWG1WGAhttps
Wed Feb 19 15:49:28 +0000 2020,3154280835,2,"Att. @realDonaldTrump @POTUS @Pontifex_es @cnni @washingtonpost @WSJ This is Dominican Republic, pay attenionhttps://twitter.com/Manuelrojasrod/status/1230259413342093313 …",@realDonaldTrump @POTUS @Pontifex_es @cnni @washingtonpost @WSJ,
Wed Feb 19 15:49:28 +0000 2020,264575268,0,NeNe acts just like Donald Trump if you think about it.,,
Wed Feb 19 15:49:27 +0000 2020,31282997,0,That's great and all....but she didn't have a firearm.,,
Wed Feb 19 15:49:27 +0000 2020,482691922,0,@POTUS @realDonaldTrump @DonaldJTrumpJr check out what happened in Cambridge Mass. Illegal aliens will NOT be arrested if driving without a license. The city council specifically says to keep them out of the clutches of the federal government that’s out of control. Seriously?!?!,@POTUS @realDonaldTrump @DonaldJTrumpJr,
Wed Feb 19 15:49:27 +0000 2020,1158720214764326912,0,#leftshatematters #WalkAway #LiberalismIsAMentalDisorderpic.twitter.com/UVK3aYJfbB,,#leftshatematters #WalkAway #LiberalismIsAMentalDisorderpic
Wed Feb 19 15:49:27 +0000 2020,887675192897675264,0,Ask OJ. Lol,,
Wed Feb 19 15:49:26 +0000 2020,2247472448,0,Trump in2020!!!,,
Wed Feb 19 15:49:26 +0000 2020,15800075,0,I had to block em both. Mentally disordered leftist atheists are exhausting,,
Wed Feb 19 15:49:26 +0000 2020,4580025980,0,That's because of the Republican House and Senate though.,,
Wed Feb 19 15:49:26 +0000 2020,1151481710678118400,0,TDS stage 5 pic.twitter.com/Yldme6rSp1,,
Wed Feb 19 15:49:25 +0000 2020,724594033033666561,0,SO AWESOME,,
Wed Feb 19 15:49:25 +0000 2020,1183424489016758273,0,When you go looking for a fight and get schooled! Baaaahaaaa! You were strapped up but they wasn’t having your bs lmao!,,
Wed Feb 19 15:49:25 +0000 2020,19082141,0,Their fear and panic is palpable,,
Wed Feb 19 15:49:25 +0000 2020,202748734,0,I agree,,
Wed Feb 19 15:49:25 +0000 2020,1205639020992032768,0,Person who lies on cnn worried about fact based rule of law. Can’t make this up.,,
Wed Feb 19 15:49:25 +0000 2020,46777320,0,"""For more than a week, the @realdonaldtrump has been publicly open about his view of the case against his longtime friend and adviser Roger J. Stone Jr."" ( @nytimes @NYTeileen @deanbaquet) Roger Stone goes back to Richard Nixon, Ronald Reagan, Bob Dole along with Paul Manafort.",@realdonaldtrump @nytimes @NYTeileen @deanbaquet,
Wed Feb 19 15:49:25 +0000 2020,528101533,0,pic.twitter.com/WAKSvMpqiT,,
Wed Feb 19 15:49:25 +0000 2020,1203105773309612032,0,@RepAdamSchiff @HillaryClinton @SpeakerPelosi @BarackObama #suckas! @realDonaldTrump is #untouchable and #unfuckwithable. Keep try’n!https://twitter.com/SharylAttkisson/status/1230157115341377536 …,@RepAdamSchiff @HillaryClinton @SpeakerPelosi @BarackObama @realDonaldTrump,#suckas #untouchable #unfuckwithable
Wed Feb 19 15:49:24 +0000 2020,1059933794504007682,0,@realDonaldTrump pardoned @DineshDSouza. I don't think he should be bringing up campaign finance laws.,@realDonaldTrump @DineshDSouza,
Wed Feb 19 15:49:24 +0000 2020,925658480194732032,0,Arizona’s Fox watchers all in a row. It’s pretty warm there - are you passing out Koolaid?,,
Wed Feb 19 15:49:24 +0000 2020,84616084,2,"One of the best news of the week In 2012, Mitt Romney fired Richard Grenell for being gay because of Richard Grunnell. Today Donald Trump appointed him interim US intelligence chief. https://twitter.com/IranLionness/status/1230277248738971648 …",,
Wed Feb 19 15:49:24 +0000 2020,1197263042674855937,0,pic.twitter.com/LxZaI6TXj4,,
Wed Feb 19 15:49:24 +0000 2020,18154797,0,I wish I would’ve known you stayed in the area for a few days it was great meeting you Monday night in Douglas County and appreciate you autographing your book for me! KEEP TRUMP-ING ON BROTHER!,,
Wed Feb 19 15:49:24 +0000 2020,1224541964432896002,0,"Sorry to hear about your unpleasant discussion with the ignorant President Trump hater in Tahoe. Be safe, David.",,
Wed Feb 19 15:49:24 +0000 2020,49301737,1,As opposed to what YOU and 0bozo did?,,
Wed Feb 19 15:49:24 +0000 2020,1223370541958074368,0,Trumos wall builders now destroying a cemetary,,
Wed Feb 19 15:49:24 +0000 2020,3435940588,0,pic.twitter.com/ksbXonvxkx,,
Wed Feb 19 15:49:24 +0000 2020,103466695,1,Truth SIR! Fake News Polls are a disgrace!,,
Wed Feb 19 15:49:23 +0000 2020,2748711543,0,This post is why we know it’s a good choice!!! cry libs!!! CRY!!!!,,
Wed Feb 19 15:49:23 +0000 2020,922286996,3,Everyone's making fun of you @realDonaldTrump Everyone. https://twitter.com/Cyndy7777/status/1230276970698567681 …,@realDonaldTrump,
Wed Feb 19 15:49:23 +0000 2020,3232645500,0,Food for the soul.,,
Wed Feb 19 15:49:23 +0000 2020,881168413405704192,0,pic.twitter.com/lchnJHP25a,,
Wed Feb 19 15:49:23 +0000 2020,943510343875141632,0,And yet they both lied to Congress. Why are they not being charged for that?,,
Wed Feb 19 15:49:23 +0000 2020,560743147,0,Are you homophobic?,,
Wed Feb 19 15:49:23 +0000 2020,873354467281821696,1,Lalalalalala! pic.twitter.com/aP4vuM1m08,,
Wed Feb 19 15:49:22 +0000 2020,1140981673963773954,0,Play big bank take little bank and see who wins... @MikeBloomberg and @realDonaldTrump https://twitter.com/MikeBloomberg/status/1230147743760486401 …,@MikeBloomberg @realDonaldTrump,
Wed Feb 19 15:49:22 +0000 2020,311835072,0,This came from an FOIA request? Can you go to a judge and get them to stop playing childish games?,,
Wed Feb 19 15:49:22 +0000 2020,954480042117156865,0,,,
Wed Feb 19 15:49:22 +0000 2020,3279242004,0,EEEEEEEEEEEEEEEEEEEXACTLY! #TRUMP2020 TO #KEEPAmericaGREAT FOR #FOURMoreYEARS!,,#TRUMP2020 #KEEPAmericaGREAT #FOURMoreYEARS
Wed Feb 19 15:49:22 +0000 2020,481058115,0,"And yet, the jury that convicted him disagree with you. Huh. Draining that swamp, eh Don? Your attack on the United States Justice System continues apace. #GOPCorruptionOverCountry #MobPOTUS",,#GOPCorruptionOverCountry #MobPOTUS
Wed Feb 19 15:49:21 +0000 2020,1224653111362371585,0,Why are there so many homeless around Bakersfield? Why is the Kern River so dirty?,,
Wed Feb 19 15:49:21 +0000 2020,1181752928517939201,0,Drugs are bad Stop doing drugs,,
Wed Feb 19 15:49:21 +0000 2020,956690833591291904,0,You are such a Hypocrite!!!https://abcnews.go.com/Politics/blame-abc-news-finds-17-cases-invoking-trump/story?id=58912889 …,,
Wed Feb 19 15:49:21 +0000 2020,1174712731657654272,0,That's why @realDonaldTrump was elected.. The #forgottenpeoplehttps://twitter.com/seanhannity/status/1230213738906705920 …,@realDonaldTrump,#forgottenpeoplehttps
Wed Feb 19 15:49:20 +0000 2020,884110912994635776,0,@realDonaldTrump is all abou t the pay to play corruption https://twitter.com/CREWcrew/status/1230273382102568960 …,@realDonaldTrump,
Wed Feb 19 15:49:20 +0000 2020,23027134,1,Is she still looking to cause trouble? Go do something useful Anonymous Eagle,,
Wed Feb 19 15:49:20 +0000 2020,217129049,0,"Keep building your case to pardon Roger Stone, Manafort and Flynn. You don’t care about the well being of American justice. You just want to show the world you can do anything you want. The Republican Party will never survive your Presidency.",,
Wed Feb 19 15:49:20 +0000 2020,1110377028287643649,0,pic.twitter.com/gUz8YRPbP7,,
Wed Feb 19 15:49:20 +0000 2020,717016046486441985,2,No it would not. The people love our President. You will really be surprised when over 30% of the Hispanic and Black voters pick Trump. We’re past all of that 60’s shit.,,
Wed Feb 19 15:49:19 +0000 2020,21614887,0,"This is a complete lie, farm bankruptcy is up, many will be there this year, they are selling land and equipment to try and make it one more year",,
Wed Feb 19 15:49:19 +0000 2020,451062056,0,Say what you mean and mean what you say. It’s that simple.,,
Wed Feb 19 15:49:19 +0000 2020,3072678699,0,Can someone just hack her twitter and post the shit picture thousands of times,,
Wed Feb 19 15:49:19 +0000 2020,909124173150150656,0,Yes it is and there was money sent as well as supplies. Unfortunately Puerto Rico has some unsavory individuals. They recently found a warehouse with all the supplies in it. Why didn't those supplies get to the people? And where did the money go? People should be outraged.,,
Wed Feb 19 15:49:18 +0000 2020,925398615962669056,0,You day drinking ???,,
Wed Feb 19 15:49:17 +0000 2020,3618841873,0,"This after years of chronic pain , opioids and then in 2010 , Obama went after our Doctor ( he is Russian) . I happened to be at his office when they RAIDED it . Medical Records were going electronic and there was ""Resistance"" . A P.A. from Afghanistan had written unauthorized...",,
Wed Feb 19 15:49:17 +0000 2020,3199808368,0,Good thing no everyone had bone spurs!,,
Wed Feb 19 15:49:17 +0000 2020,30975246,0,@GOP @realDonaldTrump https://twitter.com/SethAbramson/status/1230254942205571077 …,@GOP @realDonaldTrump,
Wed Feb 19 15:49:17 +0000 2020,19980701,0,Russian bot,,
Wed Feb 19 15:49:17 +0000 2020,344356445,0,That is like the pot calling the kettle black when you pay people to attend your rallies.,,
Wed Feb 19 15:49:17 +0000 2020,1037467673108668416,0,"""Low class"" Donald Trump and the Wasps: Reckoning with vulgarity, snobbery and the presidency https://www.salon.com/2020/02/17/low-class-donald-trump-and-the-wasps-reckoning-with-vulgarity-snobbery-and-the-presidency/ … #SmartNews",,#SmartNews
Wed Feb 19 15:49:17 +0000 2020,234946782,0,Well I say”bring on the travesty”! Because if you hate it it must be a good thing!,,
Wed Feb 19 15:49:16 +0000 2020,2326072722,0,At some point you will have to accept reality- nobody likes to be lied to and I get it. Uneducated believe in trump because they do t confirm facts. Use your brain and research lies and you will discover he is fooling you! Research!! Venture outside his tweets and fox!,,
Wed Feb 19 15:49:16 +0000 2020,715013962165850113,1,Why did the ISP providers shut of during his “October Surprise” #FakeNews wants to control the narrative and keep the masses brainwashed about the #corruption @RudyGiuliani you tell em...,@RudyGiuliani,#FakeNews #corruption
Wed Feb 19 15:49:16 +0000 2020,1062739922401026048,0,Because...,,
Wed Feb 19 15:49:16 +0000 2020,1242721884,0,Stick to hockey... Talk to me in November when Trump wins again...,,
Wed Feb 19 15:49:16 +0000 2020,3145618658,0,"Le iba a contestar a Jorge Ramos pero me di cuenta que me tiene bloqueado, Nada más porque le dije que era el que le hacia el trabajo sucio a Trump en México y Venezuela, ni aguanta nada caray!",,
Wed Feb 19 15:49:16 +0000 2020,1096152307643940870,0,@realDonaldTrump https://twitter.com/s_compelled/status/1227780639870550018?s=19 …,@realDonaldTrump,
Wed Feb 19 15:49:15 +0000 2020,22804852,0,@Coopdawg2020 https://www.google.com/amp/s/amp.cnn.com/cnn/2019/03/25/politics/bump-stock-ban-takes-effect-tuesday/index.html … “...owners given 90 days to turn in or destroy” This is under @realDonaldTrump but hadn’t happened since @BillClinton,@Coopdawg2020 @realDonaldTrump @BillClinton,
Wed Feb 19 15:49:15 +0000 2020,881168413405704192,0,pic.twitter.com/I52T8JLmQB,,
Wed Feb 19 15:49:15 +0000 2020,1135853503,0,RIP heroes. Prayers for the families.,,
Wed Feb 19 15:49:15 +0000 2020,28270836,0,"The reason we know about it is because he paid her off during his campaign. He thought his supporters would care if he was a nasty cheater, but he underestimated how low y'all could go... smh He really could shoot someone just for the hell of it and you'd be okay with it. Sad.",,
Wed Feb 19 15:49:15 +0000 2020,17541507,1,"Fact based? Like, how on Earth were hundreds of Americans unmasked by you? Yet, you know NOTHING. NOTHING, right?",,
Wed Feb 19 15:49:15 +0000 2020,1199520777764257792,0,It's probably because you called rape sexy.,,
Wed Feb 19 15:49:15 +0000 2020,1137221831360954369,0,Who do you represent Patrick? Or is this about to be flagged as a fake account?,,
Wed Feb 19 15:49:15 +0000 2020,1220333361983643648,0,"4 more years, keep America great.",,
Wed Feb 19 15:49:15 +0000 2020,1082521234028544000,0,@realDonaldTrump @Qanon76 @DevinNunes @TGowdySC organized crime runs and infiltrates even neighborhood watch stalking programs . Watchlist corruptionhttps://twitter.com/EyesOnQ/status/1230275735329398786 …,@realDonaldTrump @Qanon76 @DevinNunes @TGowdySC,
Wed Feb 19 15:49:15 +0000 2020,1059963590692782080,0,@realDonaldTrump @POTUS @DonaldJTrumpJrhttps://twitter.com/TeaBoots/status/1230272668399697922 …,@realDonaldTrump @POTUS @DonaldJTrumpJrhttps,
Wed Feb 19 15:49:15 +0000 2020,23854841,0,https://www.psychologytoday.com/us/blog/mind-in-the-machine/201812/complete-psychological-analysis-trumps-support …,,
Wed Feb 19 15:49:14 +0000 2020,2696141629,1,,,
Wed Feb 19 15:49:14 +0000 2020,30495098,0,"Whose side are you on, traitor?",,
Wed Feb 19 15:49:14 +0000 2020,18089606,1886,The news of @RichardGrenell as DNI has electrified the conservative world. I keep getting texts celebrating this fantastic decision. @realDonaldTrump has hit another home run.,@RichardGrenell @realDonaldTrump,
Wed Feb 19 15:49:14 +0000 2020,37235037,1,Huh that's wierdpic.twitter.com/YXOAoDyTKA,,
Wed Feb 19 15:49:14 +0000 2020,59888266,0,@realDonaldTrump has pardon/commuted 26 so far. Obama did over 1900 people during his two terms. This is another false narrative purposely driven by media.,@realDonaldTrump,
Wed Feb 19 15:49:13 +0000 2020,800468828106825728,0,Skeered,,
Wed Feb 19 15:49:13 +0000 2020,754339626,0,Thank you @realDonaldTrump for freeing up crazy laws on our Ca water supply that is crippling and killing our farmers and beautiful land. President Trump Delivers Remarks to Rural Stakeholders on California Wat... https://youtu.be/1d_i1no0SiY via @YouTube,@realDonaldTrump @YouTube,
Wed Feb 19 15:49:13 +0000 2020,470335961,0,How much of that is the income from socialist Government Farm program payments?,,
Wed Feb 19 15:49:13 +0000 2020,86739446,0,Trump A great President!,,
Wed Feb 19 15:49:12 +0000 2020,2852196312,0,That too. Generally toxic as well.,,
Wed Feb 19 15:49:12 +0000 2020,894941802649628672,0,@DanJohn67857387,@DanJohn67857387,
Wed Feb 19 15:49:11 +0000 2020,887675192897675264,0,And acquitted does not equal innocent.,,
Wed Feb 19 15:49:11 +0000 2020,1198414996767756288,1,Were deep into year 3 now. Yes taking longer than we hoped but.....,,
Wed Feb 19 15:49:11 +0000 2020,300625980,0,Just the medical reports Ulrich. Please stop pretending you’ve never been to the doctor and are so confused by the difference between a letter and the actual reports for Bernie’s official records. Request your own and see the enormous difference,,
Wed Feb 19 15:49:11 +0000 2020,169137367,0,Former #Gop congressman #Dana #Rohrabacher is denying a bombshell claim from an attorney for Julian Assange — who alleged that #Rohrabacher visited the Wikileaks founder and saying that he was under instructions from President Donald Trump to o ... https://1buv.com/former-gop-rep-dana-rohrabacher-pushes-seth-rich-conspiracy/ …pic.twitter.com/zkzrDywx1d,,#Gop #Dana #Rohrabacher #Rohrabacher
Wed Feb 19 15:49:11 +0000 2020,1214020356790341632,0,Bloomberg will never be president. He has little national appeal.,,
Wed Feb 19 15:49:11 +0000 2020,3154280835,1,"Att. @realDonaldTrump @POTUS @Pontifex_es @cnni @washingtonpost @WSJ This is Dominican Republic, pay attenionhttps://twitter.com/jhonatanliriano/status/1230268543092117509 …",@realDonaldTrump @POTUS @Pontifex_es @cnni @washingtonpost @WSJ,
Wed Feb 19 15:49:11 +0000 2020,873041455970828288,0,,,
Wed Feb 19 15:49:10 +0000 2020,429220130,0,More family farmers went bankrupt this year than ever. More farmer suicides. Thanks DJT!,,
