timestamp,Username,Retweets,Text,Mentions,Hashtags
Wed Feb 19 15:56:42 +0000 2020,2246433745,0,Yep! Sure do. Gray hair looks good on young women but only a few older women can pull it off. sigh,,
Wed Feb 19 15:56:42 +0000 2020,166672420,0,@VirguezFranklin @VirguezFranklin · 14min Lo designó la @AsambleaVE el único órgano legal vigente en Venezuela. Además tu amigo Narcolas Maduro no ganó las elecciones ya que estas fueron fraudulentas.,@VirguezFranklin @VirguezFranklin @AsambleaVE,
Wed Feb 19 15:56:41 +0000 2020,1169450476124794880,0,#Delusional,,#Delusional
Wed Feb 19 15:56:41 +0000 2020,2404223438,0,Erm....in WHAT WAY is this an awesome choice? Or are you just winging it on your Common Sense that this FEELS like a great choice or you need to SAY it's a great choice to your audience or to support your side?,,
Wed Feb 19 15:56:41 +0000 2020,1084502698983079938,0,Called us by name not of our parents devices and not responsible for our gender.,,
Wed Feb 19 15:56:41 +0000 2020,403120182,3,"Sorry about your luck. Trump is bringing back AMERICA. Like it, or leave it.",,
Wed Feb 19 15:56:40 +0000 2020,1143052604634566658,8,あの象徴的なバカは、国民が洗脳された結果とはいえ、残念ながら今の日本人が作り出した現実です,,
Wed Feb 19 15:56:40 +0000 2020,1161784675666452481,7,pic.twitter.com/tsT2biCkiv,,
Wed Feb 19 15:56:40 +0000 2020,1137080135419437056,0,This is disgusting it's time we put these murderous criminals on trial and in prison!,,
Wed Feb 19 15:56:39 +0000 2020,762044966,0,Yes. Yes “you” were honey. Now lay back down and go to sleep. Silly girl.,,
Wed Feb 19 15:56:39 +0000 2020,821173258842042369,0,God bless these men! Enjoy the rally! #TRUMP2020,,#TRUMP2020
Wed Feb 19 15:56:39 +0000 2020,722621929413308416,0,Why do you think separating children from their families and putting them in cages is a good idea?,,
Wed Feb 19 15:56:39 +0000 2020,815688356952768516,0,You worried bro?... cause you sound worried.,,
Wed Feb 19 15:56:39 +0000 2020,20268039,0,pic.twitter.com/vKA89j8Csr,,
Wed Feb 19 15:56:39 +0000 2020,500391228,0,Fake news,,
Wed Feb 19 15:56:39 +0000 2020,1225152687798472704,0,@jasonguess8,@jasonguess8,
Wed Feb 19 15:56:39 +0000 2020,1225574719060987904,36,LMAO!,,
Wed Feb 19 15:56:38 +0000 2020,48452315,0,You’re lying to us.https://www.reuters.com/article/us-usa-farms-bankruptcy-idUSKBN1ZT2YE?utm_campaign=trueAnthem%3A+Trending+Content&utm_medium=trueAnthem&utm_source=facebook …,,
Wed Feb 19 15:56:38 +0000 2020,3240753078,2,https://shareblue.com/chuck-grassley-republican-senator-trump-trade-war-tariffs-farmers/ …,,
Wed Feb 19 15:56:38 +0000 2020,2484508987,0,Neil Young Pens Open Letter to Donald Trump: ‘You Are a Disgrace to My Country’ https://www.rollingstone.com/music/music-news/neil-young-letter-trump-954835/ … via @RollingStone,@RollingStone,
Wed Feb 19 15:56:38 +0000 2020,879329286708051968,0,The farmers really don’t believe this BS .,,
Wed Feb 19 15:56:37 +0000 2020,882587040872882177,1,"Chris Murphy is a traitor. He lies, cheats, and steals to advance a radical liberal agenda. He doesn’t give a damn about his constituents in Connecticut.",,
Wed Feb 19 15:56:37 +0000 2020,49725848,0,pic.twitter.com/JG90wBVWgz,,
Wed Feb 19 15:56:37 +0000 2020,898601947376254978,0,"Mr President @Potus I respectfully ask that you don't squabble or name call. Your record,your patriotism,your success need to be the focus.Trump2020 red Red floor",@Potus,
Wed Feb 19 15:56:37 +0000 2020,97129809,0,@DonaldJTrumpJr or @IvankaTrump,@DonaldJTrumpJr @IvankaTrump,
Wed Feb 19 15:56:37 +0000 2020,189404173,0,No it rewards illegal behavior in any form.,,
Wed Feb 19 15:56:37 +0000 2020,1055593156262141954,1,Watch my RETWEETS in a few min. John Kennedy Jr explains it all.,,
Wed Feb 19 15:56:37 +0000 2020,17625521,0,"Good one, Jen!",,
Wed Feb 19 15:56:37 +0000 2020,3004315106,0,OH HOW I MY TWEETER & CHIEF @realDonaldTrump pic.twitter.com/dwELhBgeLD,@realDonaldTrump,
Wed Feb 19 15:56:36 +0000 2020,1182078308873318400,0,Why do you retweet your lies?,,
Wed Feb 19 15:56:36 +0000 2020,24677514,2,"Excellent choice. He's intelligent & highly capable. Also, he won't be spending all of his time trying to stab @realDonaldTrump in the back. AND - He's NOT part of the #Resistance!https://twitter.com/hughhewitt/status/1230278969557053440 …",@realDonaldTrump,#Resistance
Wed Feb 19 15:56:36 +0000 2020,753931719955345408,0,Bile.,,
Wed Feb 19 15:56:36 +0000 2020,56255418,0,...Indian. A race that has been treated worse than any other in this country. Mainly because they were mostly killed. But I digress.,,
Wed Feb 19 15:56:36 +0000 2020,23715284,0,Unfounded @CNN bullshit. #FakeNews,@CNN,#FakeNews
Wed Feb 19 15:56:36 +0000 2020,1133787811046469632,0,All I want in a political candidate is someone who fights for the rights of the disabled and views women as more than objects...many Republicans fit the bill... @realDonaldTrump does not.,@realDonaldTrump,
Wed Feb 19 15:56:36 +0000 2020,235286923,0,Beautiful,,
Wed Feb 19 15:56:35 +0000 2020,28731048,0,@realDonaldTrump are you going to bring up your ROLLBACK OF CLEAN WATER PROTECTIONS?,@realDonaldTrump,
Wed Feb 19 15:56:35 +0000 2020,4711385353,0,GOD BLESS AND RESTORE CALIFORNIA! RED STATE CALIFORNIA 2020,,
Wed Feb 19 15:56:35 +0000 2020,379314159,5,Will you put it on youtube?,,
Wed Feb 19 15:56:35 +0000 2020,819663787112468480,0,Running scared are we!,,
Wed Feb 19 15:56:35 +0000 2020,542172615,0,WTAF? He tried to sell a senate seat. #FuckBlago,,#FuckBlago
Wed Feb 19 15:56:35 +0000 2020,4530914532,0,Liar he was proven guilty just like you btw how’s Assange doing I heard another scandal is coming your way,,
Wed Feb 19 15:56:34 +0000 2020,274623671,0,Socialism is the noun you’re searching for.,,
Wed Feb 19 15:56:34 +0000 2020,1207733050727112704,0,Nobody can see this without choking up. Trump has such appreciative loyal supporters. I hope Donald realizes how he has positively improved our lives the past 3 years. This is America Great Again!,,
Wed Feb 19 15:56:34 +0000 2020,2849198470,0,"Bregman: Home: .273 BA/.342 OBP/.515 SLG/.857 OPS, 9 H, 2 HR & 6 RBI Away: .154 BA/.175 OBP/.333 SLG/.508 OPS, 6 H, 2 HR & 4 RBI McCann: Home: .300 BA/.382 OBP/.467 SLG/.849 OPS, 9 H, 1 HR & 7 RBI Away: .037 BA/.161 OBP/.037 SLG/.198 OPS, 1 H, 0 HR & 0 RBI FACTS !!!!",,
Wed Feb 19 15:56:33 +0000 2020,2301830888,0,Because President Trump > President Obama!!!!,,
Wed Feb 19 15:56:33 +0000 2020,824673488896135168,0,This hasn't been updated in a few months so here's at least 319 things that PROVE YOU ARE A LIARhttps://www.washingtonexaminer.com/washington-secrets/exclusive-trump-list-shows-319-results-and-promises-kept-in-three-years …,,
Wed Feb 19 15:56:33 +0000 2020,613116181,0,Why? Have you ever shot one?,,
Wed Feb 19 15:56:33 +0000 2020,20435808,2,THE GREATEST PRESIDENT EVER. AS SIMPLE AS THAT. YES TECHNOLOGY HAS ASSISTED GREATLY BUT IT STILL TAKES THE MAN AND HIS WIFE GUIDING HIM @FLOTUS,@FLOTUS,
Wed Feb 19 15:56:32 +0000 2020,1229525807380353024,0,"HRM Mike Bloomberg, Looks down so far To see us cower - he thinks. But POTUS Donald J Trump Has the power, And looks across to us Every hour, Manly and true; As no Mini Mike Bloomberg Will ever do.",,
Wed Feb 19 15:56:32 +0000 2020,1114528766401716225,0,pic.twitter.com/KbyxWn7Qtz,,
Wed Feb 19 15:56:32 +0000 2020,829434980262506496,0,Yikes! CA hates you both. Traitors!pic.twitter.com/rJuyRo3KSy,,
Wed Feb 19 15:56:32 +0000 2020,413261009,0,"Oh my goodness! I hope you are right, Harriet!",,
Wed Feb 19 15:56:32 +0000 2020,1135223293,0,Great job again! Thank you! MAGA and KAG!,,
Wed Feb 19 15:56:32 +0000 2020,1127743535799779329,1,"Good decision POTUS. But to be fair, James Comey and the FBI agents who signed those illegal FISA warrants should be arrested today; their signatures are enough probable cause for them to be arrested for felony perjury, they deserve one year each. Good Justice goes both ways.",,
Wed Feb 19 15:56:31 +0000 2020,1357895882,0,,,
Wed Feb 19 15:56:31 +0000 2020,26242789,0,Are you delusional or lying?,,
Wed Feb 19 15:56:31 +0000 2020,1216711030786723840,0,This is just devastating us that this is happening to you,,
Wed Feb 19 15:56:31 +0000 2020,18658371,0,Donald Trump 'offered Julian Assange a pardon if he denied Russia link to hack' | Media | The Guardian https://www.theguardian.com/media/2020/feb/19/donald-trump-offered-julian-assange-pardon-russia-hack-wikileaks …,,
Wed Feb 19 15:56:30 +0000 2020,805309286,0,Curious why it's only 3 players...oh that's right because your mom only knows how to research one sided stats to fit a narrative lmfao...we still whooped yall the following year. What's your excuse about that?? Lolpic.twitter.com/x9rAj59nXw,,
Wed Feb 19 15:56:30 +0000 2020,532665809,0,Unfair to Jackasses!,,
Wed Feb 19 15:56:30 +0000 2020,115536866,0,"Really hard to tell who the sword swallower is, maybe a carnival of sword swallowers but surely there are some other acts?",,
Wed Feb 19 15:56:30 +0000 2020,1192554760706113537,0,"President @realDonaldTrump is for We The People. His memorandum from August of last year waving the student debt of 25,000 disabled veterans hit my husband's account last week! Thank you Mr. President! pic.twitter.com/eFYLK7TXyL",@realDonaldTrump,
Wed Feb 19 15:56:29 +0000 2020,2830106387,0,@realDonaldTrump I hope Bloomberg kicks your ass! You're such a wuss or a gag I haven't figured out and don't care. You don't belong where you are and never did.,@realDonaldTrump,
Wed Feb 19 15:56:29 +0000 2020,1218953093552975877,0,Help the farmers,,
Wed Feb 19 15:56:29 +0000 2020,863457912307326976,0,I call bullshit,,
Wed Feb 19 15:56:29 +0000 2020,709888876328779776,1,The most loved man in America and around the WORLD @realDonaldTrump !,@realDonaldTrump,
Wed Feb 19 15:56:29 +0000 2020,1125834216497762304,0,You sir are an @ss clown,@ss,
Wed Feb 19 15:56:28 +0000 2020,834870335669350401,0,@realDonaldTrump Sir check out the WWII VET AT YOUR RALLY TONIGHT!!,@realDonaldTrump,
Wed Feb 19 15:56:28 +0000 2020,464228783,0,@realDonaldTrump is the least American President in history,@realDonaldTrump,
Wed Feb 19 15:56:28 +0000 2020,560743147,0,And you never politicized anything for Obama?,,
Wed Feb 19 15:56:28 +0000 2020,1178840659605774336,0,Someone’s trying for another DUI with this tweet.,,
Wed Feb 19 15:56:28 +0000 2020,1187067971304333312,0,I’ll be watching like every night,,
Wed Feb 19 15:56:28 +0000 2020,54919904,0,Aquí estamos en eso tambiénpic.twitter.com/Qw8YYMrDNs,,
Wed Feb 19 15:56:28 +0000 2020,4739141603,0,Nut case alert.,,
Wed Feb 19 15:56:28 +0000 2020,153860263,0,"Here’s a funny one: You claim to be a Steyer supporter in your profile, BUT YOU CAN’T EVEN SPELL HIS NAME RIGHT.",,
Wed Feb 19 15:56:27 +0000 2020,800701808301613056,0,You shouldn’t care what liberals think. I don’t...screw them.,,
Wed Feb 19 15:56:27 +0000 2020,632149155,1,"My daughter has just registered to vote too. Now all four of my kids will be voting blue. I raised them right...respect women, do not let a man disrespect you, don’t lie, don’t cheat, don’t do drugs, don’t bully others, love all others as a God does, do not hate, fight corruption",,
Wed Feb 19 15:56:27 +0000 2020,984964882830385152,0,Farm bankruptcies are way up under Trump,,
Wed Feb 19 15:56:27 +0000 2020,1214961180390744064,0,"Yes and the soldier too Except if you have TBI, he likes soldiers that don’t have TBI aka headaches",,
Wed Feb 19 15:56:27 +0000 2020,3408030185,0,"Did you see all the Republican who defended Trump. Pompous arrogant, self serving. I’m not really happy with any of them. I want real people, that have worked or served our country. All this corruption is bad on all sides.",,
Wed Feb 19 15:56:27 +0000 2020,1221971911749533698,0,Then they would pass vetting and be let in. I'm just saying everyone can't just come in just because they don't like where they are.,,
Wed Feb 19 15:56:26 +0000 2020,233723894,2,"sure... Why don't you tweet us a copy of the ""AD""? #ThatsWhatWeThought",,#ThatsWhatWeThought
Wed Feb 19 15:56:26 +0000 2020,16071190,0,@JRubinBlogger @maddow @Lawrence @JoeNBC It will take everyone including the media to do the right thing and remove Donald Trump from office! https://twitter.com/waltshaub/status/1230279316069666817 …,@JRubinBlogger @maddow @Lawrence @JoeNBC,
Wed Feb 19 15:56:26 +0000 2020,1201592610135183360,0,Lebron carries himself as educated and holier than thou. He’s arrogant sometimes. Walker just kinda seems like a boomer.,,
Wed Feb 19 15:56:25 +0000 2020,14631602,0,Not an IQ=156 tweet. Try again.,,
Wed Feb 19 15:56:25 +0000 2020,488913214,0,"As The Daily Wire reports: Former Illinois governor Rod Blagojevich, convicted years ago of corruption but released Tuesday after having his sentenced commuted by President Donald Trump, revealed his gratitude for the decision in his first interview following his release",,
Wed Feb 19 15:56:25 +0000 2020,919683153056489472,0,"Easy, @DonaldJTrumpJr",@DonaldJTrumpJr,
Wed Feb 19 15:56:24 +0000 2020,822914299190448128,0,Too dangerous? He literally pardoned a war criminal without batting an eye,,
Wed Feb 19 15:56:24 +0000 2020,1046843487646359552,4,this & the birtherism are insane,,
Wed Feb 19 15:56:24 +0000 2020,2975679868,0,Love it. Also love the guys shirt.... 17 - wwg1wga. Nice way to get around the Q ban.,,
Wed Feb 19 15:56:24 +0000 2020,4709748796,0,"Something's funny about Mike? ""I know Donald Trump. He's a great guy. He doesn't do everything he says, but he sure tries. And I'm a big fan of Donald Trump."" Bloomberg once praised Trump as a 'great guy,' referred to himself as 'big fan' of future POTUS https://www.foxnews.com/media/michael-bloomberg-trump-great-guy-big-fan …",,
Wed Feb 19 15:56:24 +0000 2020,1199775550233071620,0,#FakeNews Berners have yet to be chased off of my neighbor's lawns.,,#FakeNews
Wed Feb 19 15:56:23 +0000 2020,23529546,0,#ConstitutionalCrisis #ImpeachedForLife #IntellectuallyUnfit #TheResistance #DonaldTrump #PutinsPuppet #StableGenius #UkraineGate #WWG1WGA #DirtyDonald #TrumpKnew #TrumpGOP #TrumpCult #KAG2020 #AltRight #QAnon #MAGA #Resist #GOP #KAG #KEKpic.twitter.com/R9uiUJ6Gjj,,#ConstitutionalCrisis #ImpeachedForLife #IntellectuallyUnfit #TheResistance #DonaldTrump #PutinsPuppet #StableGenius #UkraineGate #WWG1WGA #DirtyDonald #TrumpKnew #TrumpGOP #TrumpCult #KAG2020 #AltRight #QAnon #MAGA #Resist #GOP #KAG #KEKpic
Wed Feb 19 15:56:23 +0000 2020,789876171030732800,1,pic.twitter.com/n7eokdNQXz,,
Wed Feb 19 15:56:23 +0000 2020,33149248,0,"On what do you base the claim of ""greatest president of all time""? Is it the economy? Yeah, the economy is doing very well, but it has been better. Trade deals? Yep, he made some trade deals. They seem ok. Also nothing special or ""greatest"" about them. What are you talking about?",,
Wed Feb 19 15:56:23 +0000 2020,21946950,0,"Trump has no idea what it means to ""payoff"" anyone--he's used to screwing over contractors and the people he hires. I can see why this baffles him. Of course, everything baffles the #CarnivalBarkingClown Trump.",,#CarnivalBarkingClown
Wed Feb 19 15:56:23 +0000 2020,469890568,0,God bless you all!,,
Wed Feb 19 15:56:23 +0000 2020,968560566322147329,1,"Besides, everyone knows how he got to be president. He cheats. Has his entire life & will do it till the day he dies.",,
Wed Feb 19 15:56:23 +0000 2020,3653083512,0,Exactly!,,
Wed Feb 19 15:56:23 +0000 2020,736659586657226753,0,If so he is doing a shitty job unless the goal is to elect Bernie,,
Wed Feb 19 15:56:22 +0000 2020,1229162888478150657,23,TODAY WED 2/19/00 LIVE #KeepAmericaGreat #Phoenix AZ 2/19/2020 TIME | 6pPac | 7pMt | 9pE | Guest POTUS Donald Trump RT #TrumpRally trending @POTUS @realDonaldTrump #PhoenixRally #4MoreYears @alley167 @ChrisMo37540912 https://youtu.be/CpeyuC8t09o,@POTUS @realDonaldTrump @alley167 @ChrisMo37540912,#KeepAmericaGreat #Phoenix #TrumpRally #PhoenixRally #4MoreYears
Wed Feb 19 15:56:22 +0000 2020,44984619,0,"Oh gosh. You'd never see a Democrat helping another, like th pic.twitter.com/SJwGWWDEtN",,
Wed Feb 19 15:56:22 +0000 2020,108751302,0,AWWWWWW BEAUTIFUL @realDonaldTrump supporters are GOOD people SO PROUD TO SUPPORT OUR @POTUS @SebGorka @SecPompeo @seanhannity @TuckerCarlson @IngrahamAngle @codeofvets @patrioticpets @Vets4TrumpORG @Deplorablevet59 @KAGSouth4Trump @Veteran4Trump @Oprahhttps://twitter.com/DonaldJTrumpJr/status/1230269630318444544 …,@realDonaldTrump @POTUS @SebGorka @SecPompeo @seanhannity @TuckerCarlson @IngrahamAngle @codeofvets @patrioticpets @Vets4TrumpORG @Deplorablevet59 @KAGSouth4Trump @Veteran4Trump @Oprahhttps,
Wed Feb 19 15:56:22 +0000 2020,938331104,0,"Most lies by any President in history, by far! You’re going to prison.",,
Wed Feb 19 15:56:22 +0000 2020,500391228,0,If you like him he’s a bad Apple.,,
Wed Feb 19 15:56:22 +0000 2020,845813234951073793,0,Pot,,
Wed Feb 19 15:56:22 +0000 2020,565956323,0,Homophobic,,
Wed Feb 19 15:56:21 +0000 2020,2462217400,0,"Because Obama stopped the Recession after another Republican President totally brought down USA‘s economy. Obama is the one who should be credited not you, who is slowly destroying everything Obama put in place. Just out of spite because you know Obama is 1000 times better.",,
Wed Feb 19 15:56:21 +0000 2020,1162036333113573376,0,“Fact based...”pic.twitter.com/TpCHeF5P5n,,
Wed Feb 19 15:56:21 +0000 2020,783497350148939776,0,"UNITED Americans we love our great country, our great President Trump, our military and law enforcement officers! We are the greatest country in the world",,
Wed Feb 19 15:56:21 +0000 2020,405086706,0,You have no mutts. Girl voice.,,
Wed Feb 19 15:56:21 +0000 2020,284741755,0,Once again thanks Obama,,
Wed Feb 19 15:56:20 +0000 2020,65336280,0,pic.twitter.com/8UU8INOzqK,,
Wed Feb 19 15:56:19 +0000 2020,1132330916,0,Are you seriously complaining about politicization? Your daddy Barack nearly destroyed and politicized every American institution he touched. Thank God for Trump! Your days in Gov are over.,,
Wed Feb 19 15:56:19 +0000 2020,1117209292556443648,0,"Democrats & Deep State s TDS PANIC is priceless entertainment @realDonaldTrump trolling the [DS} with twitter is hitting paydirt! Now Seditious Traitors in ALL branches of Government are showing themselves. Keep tweeting, Mr. President! The World is enjoying the show pic.twitter.com/Z7M5SCmnBU",@realDonaldTrump,
Wed Feb 19 15:56:19 +0000 2020,1713653154,0,You being mad about it tells me it was a good move. It really is that simple,,
Wed Feb 19 15:56:19 +0000 2020,39076082,572,One of these not like the others.pic.twitter.com/V9KYKebJ1P,,
Wed Feb 19 15:56:19 +0000 2020,1080134254187724800,0,"Tyrone, you like the Obama’s, I despise the Obama. This guy is one, if not the most corrupt presidents that has ever been and you worship him. Not me, not ever. Is your life better because of Obama? My life certainly isn’t, however, under Trump, business is good!",,
Wed Feb 19 15:56:18 +0000 2020,796193244501737472,0,Ngl but mad props to trumps supporters Atleast They have Respect for the people that gave their service for us to even have political opinions no matter what political stance Unlike Those freaking liberals,,
Wed Feb 19 15:56:18 +0000 2020,1227079897836851201,0,i just hope all involved will pay for they re crimes ! 200 yrs ago this would have been TREASON . TRUMP 2020,,
Wed Feb 19 15:56:18 +0000 2020,1151173990628638720,0,One man calls out the deep state and look at these army's of Americans! Trump fights for freedom for everyone from corrupt governments around the world because thats what America is and we know it. We salute you sir! Trump 2020!,,
Wed Feb 19 15:56:18 +0000 2020,1184508462857895936,0,"Vote Trump/Pence 2020 and follow those who follow you... God is good, God has given us this great wake-up call and grand opportunity to save our Republic... Don't piss it away...",,
Wed Feb 19 15:56:18 +0000 2020,1017941354393948160,0,So is Trump just letting all his criminal friends out of jail now? This sounds perfectly above board. Lol.,,
Wed Feb 19 15:56:17 +0000 2020,911788745484943360,0,"Bloomberg told Trump 'yes, Donald, I do love you' in resurfaced 2016 video https://nypost.com/2020/02/19/bloomberg-told-trump-yes-donald-i-do-love-you-in-resurfaced-clip-from-2016/ … #SmartNews",,#SmartNews
Wed Feb 19 15:56:17 +0000 2020,1074882966,0,Moron,,
Wed Feb 19 15:56:17 +0000 2020,606926247,0,"I certainly would not try to deny those facts, 100% spot on. It will be interesting though, as we are hearing Democrat registrants attending @realDonaldTrump rallies, how many of them have doubts and start to rethink where they stand on the political line. As the #WalkAway....",@realDonaldTrump,#WalkAway
Wed Feb 19 15:56:17 +0000 2020,2206792559,0,The two of you should get along well,,
Wed Feb 19 15:56:17 +0000 2020,1018678909179777024,0,Donald Trump (full disc: not a fan) has been in public eye for decades. He was never called a racist until he put an R next to his name. He even was the first to integrate the WPB country clubs (arguably the most racist area of the US).,,
Wed Feb 19 15:56:17 +0000 2020,789360460692852736,0,"I just have to say, l freaking love this President. Enjoy it Patriots. God only knows if & when we'll ever see someone like him again. Cali Concervatives! We love you @realDonaldTrump https://twitter.com/harley_guy07/status/1230278626987261952 …",@realDonaldTrump,
Wed Feb 19 15:56:16 +0000 2020,103167711,0,Probably.......,,
Wed Feb 19 15:56:16 +0000 2020,27148509,0,#Cult45,,#Cult45
Wed Feb 19 15:56:16 +0000 2020,785314227107921920,0,This one wont RETWEET Says something went wrong.AGAIN.,,
Wed Feb 19 15:56:15 +0000 2020,1229477459407536128,0,Mr Trump can you please take a look at my tweets that I had sent out to you .ok gabelbarb@gmail.com or yesbaby58@yahoo.com,@gmail @yahoo,
Wed Feb 19 15:56:15 +0000 2020,1098426832473415680,0,He is trying to restore America and the Republicans and Americans are supporting him!pic.twitter.com/DSVFYOzOAT,,
Wed Feb 19 15:56:15 +0000 2020,1036054457744805889,2,This is so accurate ! @realDonaldTrump @BestCloserShow @SassyInfidel @srb1110https://twitter.com/McNaughtonArt/status/1221186177924861953 …,@realDonaldTrump @BestCloserShow @SassyInfidel @srb1110https,
Wed Feb 19 15:56:15 +0000 2020,1193538712375906304,0,@realDonaldTrump @SenateDems @SenateGOP #RemoveTrumppic.twitter.com/a4u0xPb1fU,@realDonaldTrump @SenateDems @SenateGOP,#RemoveTrumppic
Wed Feb 19 15:56:15 +0000 2020,126733482,0,"Hey Donald Trump, the science is on my side, and I'd like to see how your hair would fare in a blizzard. https://www.twitch.tv/ratbrother pic.twitter.com/0VKRc0yR1H",,
Wed Feb 19 15:56:14 +0000 2020,738646878,2,Anyone else feeling like America is on a slippery slope to authoritarianism and most people won't know it until it's too damned late. Sad.,,
Wed Feb 19 15:56:14 +0000 2020,83716493,0,pic.twitter.com/3IeGFlomnS,,
Wed Feb 19 15:56:14 +0000 2020,973895475047927808,0,This is a lie.,,
Wed Feb 19 15:56:14 +0000 2020,16717127,0,"I will have to suck it up and vote for @BernieSanders though, if #BogusPotus @realDonaldTrump is the alternative. Sanders is 1 of the 5 least effective ppl sitting in @USSenate, the #BernieBros cannot be counted upon to vote for the nominee and he gives me a sour stomach",@BernieSanders @realDonaldTrump @USSenate,#BogusPotus #BernieBros
Wed Feb 19 15:56:14 +0000 2020,337707805,0,Donald Trump 'offered Julian Assange a pardon if he denied Russia link to hack' https://www.theguardian.com/media/2020/feb/19/donald-trump-offered-julian-assange-pardon-russia-hack-wikileaks?CMP=share_btn_tw …,,
Wed Feb 19 15:56:14 +0000 2020,2696141629,0,CLUELESS TRUMP 2020 pic.twitter.com/acOxWpetZZ,,
Wed Feb 19 15:56:14 +0000 2020,74278654,0,"You've worked very hard for we the people Kevin, great job thank you so very much! Enjoy home Bakersfield is proud America's proud. https://www.suijuriscourtangels.com pic.twitter.com/esGS4DosIR",,
Wed Feb 19 15:56:13 +0000 2020,23760961,0,"GOD BLESS OUR MILITARY, GOD BLESS @realDonaldTrump GOD BLESS TRUMPS SUPPORTERS GOD BLESS AMERICA.. https://twitter.com/Jamierodr14/status/1230265149992394753 …",@realDonaldTrump,
Wed Feb 19 15:56:13 +0000 2020,822807919175630851,0,Of course it was @realDonaldTrump dear. Now go in your safe space and take your meds.,@realDonaldTrump,
Wed Feb 19 15:56:13 +0000 2020,1108106340583378944,0,Democrats are losing the argument.. USMCA has been a huge success for farmers... I like to thank China for bailing out the farmers...,,
Wed Feb 19 15:56:13 +0000 2020,124931689,0,Young sexy women who know there is a sexual assault payday if they can get close enough to a name with the last name Trump.,,
Wed Feb 19 15:56:13 +0000 2020,423631314,0,Amen!,,
Wed Feb 19 15:56:13 +0000 2020,788933402560954369,0,Does anyone think another candidate could ever get these kind of crowds?,,
Wed Feb 19 15:56:12 +0000 2020,829910644082110465,0,Amazing Find!! Brilliant,,
Wed Feb 19 15:56:12 +0000 2020,1165603880840957952,0,,,
Wed Feb 19 15:56:12 +0000 2020,1224667457937428481,0,Farm bankruptcies have hit an 8 year high. Big increase in farmer suicides also.,,
Wed Feb 19 15:56:12 +0000 2020,1360140186,0,Get your facts straight.,,
Wed Feb 19 15:56:12 +0000 2020,1095345126002458625,0,What they’ve really done is to let the DOJ know who needs to get the boot.,,
Wed Feb 19 15:56:11 +0000 2020,1130971258391105537,0,No more elle for our family,,
Wed Feb 19 15:56:11 +0000 2020,15547487,0,"He was attempting to sell the Senate seat. He was tried, found guilty and sentenced. You sympathize with him, because like you, he is a criminal. Birds of a feather and all that.",,
Wed Feb 19 15:56:11 +0000 2020,1217844323271741443,0,Is this all you have to do with our time as this countries president. Find something to do instead of bitching all the time. Wtf,,
