timestamp,Username,Retweets,Text,Mentions,Hashtags
Tue Feb 18 15:57:34 +0000 2020,994248527281770497,1,"You know, before Obummer, the dems were always a bit “off” and difficult to listen to at times. Post Obummer, dems are just bat a$$ crazy and impossible to stomach !!",,
Tue Feb 18 15:57:34 +0000 2020,1004807643918200832,1,"he even HAD to dissolve his own charity because the whole family stole from kids with cancer if THAT'S not a ""C'Mon Man"" moment...nothing is if he can't run a charity...how can he run a country?",,
Tue Feb 18 15:57:34 +0000 2020,1197253405653262338,0,Never underestimate the hatred the Democrats have for Americans,,
Tue Feb 18 15:57:34 +0000 2020,41650190,0,You have freedom to say and do what you want but that doesnt mean there wont be any repercussions.alot of people forget this even our president sadly,,
Tue Feb 18 15:57:34 +0000 2020,728329545548337152,0,@realDonaldTrump pic.twitter.com/ThbQuoHnJD,@realDonaldTrump,
Tue Feb 18 15:57:33 +0000 2020,1040418473849937920,0,Is @realDonaldTrump on an 'elitist' pardon spree or a shopping spree for elitists? @GOP? @WhiteHouse? + corruption & fraud = 2nd term for Führer Drumpf IMPEACHED FOREVER http://www.usdebtclock.org the countdown to America's bankruptcy https://twitter.com/psychdr100/status/1229851684219707393 …pic.twitter.com/zGw40sD2Ig,@realDonaldTrump @GOP @WhiteHouse,
Tue Feb 18 15:57:33 +0000 2020,2448738077,1,"tell that to her. she harassed students, adults, and children because they have different opinions than her. and she also shits her pants. potty training is like step ONE to learning to grow up",,
Tue Feb 18 15:57:33 +0000 2020,1176612382141026309,0,That's a LIE,,
Tue Feb 18 15:57:33 +0000 2020,1190072963938373632,0,,,
Tue Feb 18 15:57:33 +0000 2020,637449762,0,Mini? Like your wallet compared to his? #IMPOTUS,,#IMPOTUS
Tue Feb 18 15:57:33 +0000 2020,2655537606,0,pic.twitter.com/Pzpvfkwoz3,,
Tue Feb 18 15:57:33 +0000 2020,720660303327993856,0,"@realDonaldTrump Donnie, the BIGGEST CROOK EVER pardoning the smaller crooks left and right, abusing POTUS powers for doing no good. What a shame!!! Con man handing out pardons (with his tiny hands) to cheaters, LIERS, looters and fraudsters, filling the swamp. SHAMELESS.",@realDonaldTrump,
Tue Feb 18 15:57:33 +0000 2020,994366135285047296,0,"Dance puppets, dance.",,
Tue Feb 18 15:57:33 +0000 2020,1171929105710878721,6,Obama is nuts for believing this! Trump 2020,,
Tue Feb 18 15:57:33 +0000 2020,959477544541216768,0,,,
Tue Feb 18 15:57:33 +0000 2020,3013635301,0,Donald Trump: I Know Who 'Anonymous' Is http://dlvr.it/RQJFjb pic.twitter.com/ElMV1vMPqo,,
Tue Feb 18 15:57:32 +0000 2020,1078315078498373637,0,@BBCAMERICA Your roku channel is down again. You go down more often than @LindseyGrahamSC goes down on @realDonaldTrump!,@BBCAMERICA @LindseyGrahamSC @realDonaldTrump,
Tue Feb 18 15:57:32 +0000 2020,1172210677718671360,0,Former WWE Superstar Eve Torres Claims President Donald Trump Forcefully Grabbed Her in 2009 #SmartNewshttps://comicbook.com/wwe/2020/02/18/wwe-superstar-eve-torres-president-donald-trump-forcefully-grabbed-her/ …,,#SmartNewshttps
Tue Feb 18 15:57:32 +0000 2020,741371012,0,@DeplorableJennnpic.twitter.com/ym7PKZsiKG,@DeplorableJennnpic,
Tue Feb 18 15:57:32 +0000 2020,710199587387084802,0,"Vickie needs to use a different meme — most of these things have been proven false or misleading, time and time again. Pure and utter BS.",,
Tue Feb 18 15:57:31 +0000 2020,65765115,0,Are you mad that he has more money than you lol,,
Tue Feb 18 15:57:31 +0000 2020,1149105898054475780,0,"Well, use your money for something good like building tiny houses for the homeless. Remodeling schools to learning Centers. Send good food for schools for all kids. Stop bullying and racism. If you want your job or anyone wants to be President you will do these things.",,
Tue Feb 18 15:57:31 +0000 2020,1181885697126518784,0,@SpeakerPelosi @realDonaldTrump is aquitted forever. Lolol https://twitter.com/realDonaldTrump/status/1229897661555212291 …,@SpeakerPelosi @realDonaldTrump,
Tue Feb 18 15:57:31 +0000 2020,776068076408152064,0,She obviously did none of that and was met with total intolerance. You and your school are a joke.,,
Tue Feb 18 15:57:31 +0000 2020,1185950814981853184,0,"If the DNC overthrows the election again like in 2016, the orange buffoon will be reelected.",,
Tue Feb 18 15:57:31 +0000 2020,719285917635063808,0,@realDonaldTrump you are one corrupt son of a bitch!! https://twitter.com/glennkirschner2/status/1229894222263787520 …,@realDonaldTrump,
Tue Feb 18 15:57:31 +0000 2020,552132610,0,I’m pretty sure he doesn’t need money!,,
Tue Feb 18 15:57:31 +0000 2020,1207126394867716096,0,LOL! How dumb do you have to be to STILL be spouting the discredited Russia nonsense?,,
Tue Feb 18 15:57:31 +0000 2020,4216952292,0,*because thats how they feel,,
Tue Feb 18 15:57:31 +0000 2020,19952173,0,And turn off the airbag,,
Tue Feb 18 15:57:31 +0000 2020,1520834342,0,GAME OVERpic.twitter.com/lRAIEH2eK1,,
Tue Feb 18 15:57:30 +0000 2020,797880471082463233,0,"Unfortunately, those are just more lies you are eating up from Trump. Let's say you're being Trumped. Alot of wall Trump promised you was refurbishment approved during the Barack Obama administration in 2009.",,
Tue Feb 18 15:57:30 +0000 2020,125793626,0,Lmao that's really funny. The idea that CIA pete will get anywhere,,
Tue Feb 18 15:57:30 +0000 2020,876507522110291968,0,lmao you deserved it,,
Tue Feb 18 15:57:30 +0000 2020,2355397466,2,"You’re kind of an awful person, so not surprisedpic.twitter.com/MbM9v3CWIb",,
Tue Feb 18 15:57:30 +0000 2020,3096922357,0,Another read the report. Perhaps keep it on your phone for actual facts of record. II. The President Obstructed the Impeachment Inquiry by Instructing Witnesses and Agencies to Ignore Subpoenas for Documents and Testimony https://intelligence.house.gov/report/#13,,#13
Tue Feb 18 15:57:30 +0000 2020,707092445377404930,0,To all uninformed liberals glued to the MSMpic.twitter.com/KkoMBvx0VG,,
Tue Feb 18 15:57:30 +0000 2020,1027916385534521344,0,Nope,,
Tue Feb 18 15:57:30 +0000 2020,45916780,0,Over 700k likes. Just sayingpic.twitter.com/XRhPpyCNzC,,
Tue Feb 18 15:57:30 +0000 2020,158889045,0,This is just stupid.,,
Tue Feb 18 15:57:30 +0000 2020,83814927,0,"He is so much more successful than you, he couldn't go broke even if he let you run his shit.",,
Tue Feb 18 15:57:30 +0000 2020,941367849586585600,0,Whatever. Get a life.,,
Tue Feb 18 15:57:30 +0000 2020,1223030269617328128,0,but you’re right about it not being magic,,
Tue Feb 18 15:57:30 +0000 2020,1185571362192134155,0,"This is his approval rate with the GOP and his base. His overall approval rating, all inclusive, is more like 37%. Worst. President. Ever.",,
Tue Feb 18 15:57:29 +0000 2020,1015446863078539264,0,mr trump is fired though,,
Tue Feb 18 15:57:29 +0000 2020,70563862,1,. @realDonaldTrump what do you think your pardons and sentence commutations of CORRUPT politicians says about your commitment to clean up corruption? It speaks volumes to me about your own corruption and criminal behavior.,@realDonaldTrump,
Tue Feb 18 15:57:29 +0000 2020,1113042051971584001,0,On closer INSPECTION: now I remember how the word CLOSER got into the picture. Thank you very much for teaching me English. In return I reward you with my keen sense for typos: you wrote Bu but probably meant but.,,
Tue Feb 18 15:57:29 +0000 2020,363327550,0,"That's ok. I know I'm over the on this!! He's already blocked me once!!! If I'm wrong, Why??? You'll soon see. CF will be exposed!!! Remember what Q said: be careful who you follow. Symbolism will be their downfall. pic.twitter.com/Dc6TSVk9Mh",,
Tue Feb 18 15:57:29 +0000 2020,1226838853593550848,0,You can do what you always do maybe? Lie. Bully. Make up your own facts. I bet if you took a sharpie and drew a circle around the areas to poll you could get a 70% rating. I will say the day you recieve a 70% approval in a truly random poll is the day my faith in the US dies.,,
Tue Feb 18 15:57:29 +0000 2020,62839633,0,pic.twitter.com/H5wFFc9V59,,
Tue Feb 18 15:57:29 +0000 2020,966074342617600001,0,,,
Tue Feb 18 15:57:29 +0000 2020,705506034698186752,0,Great !,,
Tue Feb 18 15:57:29 +0000 2020,24035558,0,"You know that the rest of the World laughs at you, right? You can hide and you can lock yourself in, that is actually what the rest of the world hope for.pic.twitter.com/0zn0tsestp",,
Tue Feb 18 15:57:28 +0000 2020,17117882,0,can you explain what you mean by corporatist please,,
Tue Feb 18 15:57:28 +0000 2020,1066126886,0,Just keep MEGA!,,
Tue Feb 18 15:57:28 +0000 2020,181385295,0,Vet!,,
Tue Feb 18 15:57:28 +0000 2020,361804591,0,Fill the swamp! Special place for his mouthpiece as well.,,
Tue Feb 18 15:57:28 +0000 2020,909756985,0,Sounds a little like a quid pro quo. I think you know what that means. Does the word #Impeachment help refresh your memory?,,#Impeachment
Tue Feb 18 15:57:28 +0000 2020,765240262117523457,0,Good one Steve!!!,,
Tue Feb 18 15:57:28 +0000 2020,831586143921664009,0,"It could be worse, I mean this one candidate a while back invited Russia to hack his opponents e-mail account on National television. I’ve seen worse.",,
Tue Feb 18 15:57:27 +0000 2020,4067629349,0,There was a bigger point being made....probably missed it...,,
Tue Feb 18 15:57:27 +0000 2020,3228932003,0,"Oh NO where are the congress and senate taxes, all multi millionaires now. Of course, you know their salaries, right? Your tax dollars silly...",,
Tue Feb 18 15:57:27 +0000 2020,3038624530,0,You look like real president best of luck again against @realDonaldTrump,@realDonaldTrump,
Tue Feb 18 15:57:27 +0000 2020,781190432,0,"Yeah, I'd believe you over a successful man like Donald Trump any day, Craig. pic.twitter.com/VIVzI9idpc",,
Tue Feb 18 15:57:27 +0000 2020,885702415,0,You can resign Dorothy!,,
Tue Feb 18 15:57:27 +0000 2020,1134827522091343879,0,"comenta la noticia pues! o te da miedo que los gringos te ""sancionen"" también a ti y te quiten la visa????",,
Tue Feb 18 15:57:27 +0000 2020,1125888911002173441,0,"The Federal Judges Association will no tdiscuss the tremendous FISA Court abuse or the fraud upon the court which was the Mueller Investigation and its ancillary ""process crimes"". That gaggle is stacked to the rafters with never Trumpers and liberal statist. Time to indict now!",,
Tue Feb 18 15:57:27 +0000 2020,786360516251877377,0,Ha,,
Tue Feb 18 15:57:27 +0000 2020,1183233531209752576,3,pic.twitter.com/vZXPRQhT5l,,
Tue Feb 18 15:57:26 +0000 2020,932384649929789441,0,"@realDonaldTrump @TuckerCarlson @IngrahamAngle Every time I watch #BernieSanders speak, I feel like I'm being lectured! #BernieTheLecturer",@realDonaldTrump @TuckerCarlson @IngrahamAngle,#BernieSanders #BernieTheLecturer
Tue Feb 18 15:57:26 +0000 2020,25516399,0,MLK would not be proud of Trump......he would flee from Trump by any means necessary... pic.twitter.com/AsXK5A7f0k,,
Tue Feb 18 15:57:26 +0000 2020,4833883605,0,pic.twitter.com/EzTfbyuc8W,,
Tue Feb 18 15:57:26 +0000 2020,1059552449613234177,0,"wth is wrong with these liberal idiots, the great economy that Trump created is benefiting all classes of people. Just because Trump is wealthy and acts like a regular Joe and has said derogatory comments liberals hate him. Wow must be tough being perfect libs",,
Tue Feb 18 15:57:26 +0000 2020,51827732,0,"You just pardoned a bunch of crooks. And Bloomberg is an actual billionaire. So full of yourself you're going after him, too? Look up ""hubris."" Then read Sophocles. Or Shakespeare.",,
Tue Feb 18 15:57:26 +0000 2020,1090688129005043712,0,Ha that’s what you get.,,
Tue Feb 18 15:57:26 +0000 2020,1198224245865758720,0,Don't worry about your poll numbers because I lie to them,,
Tue Feb 18 15:57:26 +0000 2020,717814069651066880,0,@rightideals have u seen this???,@rightideals,
Tue Feb 18 15:57:26 +0000 2020,58847621,0,When are these people going to jail?,,
Tue Feb 18 15:57:25 +0000 2020,1183911574555287552,0,"You literally go places with one intent which is to start shit with people and piss them off, what’d you expect to happen?",,
Tue Feb 18 15:57:25 +0000 2020,1178818109349797888,2,This Gentleman will go down in history as being the BEST and MOST LOVED PRESIDENT this Country of ours have ever had. Not like the #JokerMushroomDickDonny aka @realDonaldTrump @POTUS this not human DJT is a joke and laughing hazard to man kind. TRUMP HAS GOT 2 GO!!! NOW-NOW https://twitter.com/Lady_Star_Gem/status/1229440910682779648 …,@realDonaldTrump @POTUS,#JokerMushroomDickDonny
Tue Feb 18 15:57:25 +0000 2020,3389831902,0,You seriously can’t blame how these students acted on their political beliefs. Kaitlin is A BULLY.,,
Tue Feb 18 15:57:25 +0000 2020,747716678432198657,2,Truth,,
Tue Feb 18 15:57:25 +0000 2020,1215649860617150470,0,Deflection is all they have.,,
Tue Feb 18 15:57:25 +0000 2020,163308998,0,..tell me more..? NOPE instead @FBI @TheJusticeDept targets anyone who has the goods on DEMS/HRC/ #UkraineDNCCorruption to silence them. Trump should micro-manage them all! He's authorized by WTP to do just that! pic.twitter.com/XgFWbSm5oo,@FBI @TheJusticeDept,#UkraineDNCCorruption
Tue Feb 18 15:57:25 +0000 2020,32678339,0,Her right to white.,,
Tue Feb 18 15:57:25 +0000 2020,758488771314810880,0,That’s pure evil,,
Tue Feb 18 15:57:25 +0000 2020,1188395388463656960,1,pic.twitter.com/HbXwfmlAZk,,
Tue Feb 18 15:57:25 +0000 2020,1045150323218829313,0,Yet here you are still attacking his looks. What makes you better?,,
Tue Feb 18 15:57:24 +0000 2020,1076243429233954817,0,,,
Tue Feb 18 15:57:24 +0000 2020,830200810793365504,0,"Mike Bloomberg is huge in the one place that counts to Trump, his net worth. He could buy Trump’s cheesy company for cash and still have $50 Billion left over. He doesn’t need Russian payday loans like Trump.",,
Tue Feb 18 15:57:24 +0000 2020,1048991146217787392,0,Is this fuching sign language?,,
Tue Feb 18 15:57:24 +0000 2020,3324702177,1,Such a polite young man.,,
Tue Feb 18 15:57:24 +0000 2020,831055280460984320,0,Have you lost it? When is the last time you didn’t lie about ANYTHING?,,
Tue Feb 18 15:57:24 +0000 2020,2757048200,0,"Hey Steph...Draw a trend line up from any economic indicator, starting during Obama's second term. You also realize that unemployment was reduce by a greater percentage under Obama. What is the debt now? Please respond honestly. Oh, watch for DUI traps in CA!",,
Tue Feb 18 15:57:24 +0000 2020,4833396202,0,Lol when she EVER grows up we all know she'll be a Republican then.,,
Tue Feb 18 15:57:24 +0000 2020,1223730088254021637,0,Where is Hunter Biden. Where are the Krassenstein brothers. Einfach nur krass.,,
Tue Feb 18 15:57:23 +0000 2020,784754532911878144,1,LOL,,
Tue Feb 18 15:57:23 +0000 2020,575769943,0,@DNC attacks @GOP as the party of &for wealthy Umm think again They allow billionaire to buy presidency. The guy is a fraud. A socialist disguised as a politician. An oligarch acting like he cares about the American ppl. NO HE DOES NOT @realDonaldTrump POTUS,@DNC @GOP @realDonaldTrump,
Tue Feb 18 15:57:23 +0000 2020,460714882,0,as if the trade war and your pathetic tax cut did anything for the economy,,
Tue Feb 18 15:57:23 +0000 2020,1019671786550693891,0,AH SO NOW WE ARE SCARED OF BLOOMBERG I SEE!!!!!!!!! YEAH A REAL BILLIONAIRE WOULD SCARE ME TOO IF I WAS A BIG FAT ORANGE LIAR LMAO LMAO,,
Tue Feb 18 15:57:23 +0000 2020,1087825178866999297,0,"@TwitterSafety either censor all bad behavior or none. If not, than @jack and @verified is an editor. @realDonaldTrump if social media outlets censor, than they should be considered as editors. @SenTedCruzhttps://twitter.com/JackPosobiec/status/1229796962238681089 …",@TwitterSafety @jack @verified @realDonaldTrump @SenTedCruzhttps,
Tue Feb 18 15:57:22 +0000 2020,1062020225015648257,0,"You have a right to your opinion. BTW, Trump added to the swamp today with his pardons. Promises made, promises broken unless they benefit Trump.",,
Tue Feb 18 15:57:22 +0000 2020,17241829,2,I am so sick and tired of this administration forcing just the worst of American culture down everyone else’s throats. We need to defeat Donald Trump in 2020.,,
Tue Feb 18 15:57:22 +0000 2020,2378950286,0,Yawnpic.twitter.com/kpyWgFtT0L,,
Tue Feb 18 15:57:22 +0000 2020,3240238580,0,Wow fartwell you must have some serious marijuana gummies,,
Tue Feb 18 15:57:22 +0000 2020,1323617730,0,Didn’t you use your own $$ Donald? I seem to recall that....but you know that Mike’s $ makes yours look like a pittance.,,
Tue Feb 18 15:57:22 +0000 2020,1101269125786202113,0,pic.twitter.com/21byDbraoK,,
Tue Feb 18 15:57:22 +0000 2020,959495246718652416,0,"People finding you despicable shows good judgment, not bias.",,
Tue Feb 18 15:57:22 +0000 2020,1179108111736623105,0,"Trump is evil, and he rewards it.",,
Tue Feb 18 15:57:22 +0000 2020,4893608572,0,It’s ok snowflake,,
Tue Feb 18 15:57:22 +0000 2020,1002783757437267974,0,"Wow, this makes you look corrupt. Bad optics, dude.",,
Tue Feb 18 15:57:22 +0000 2020,23546241,0,There’s never been anyone in US history who’s been charged under emoluments statutes,,
Tue Feb 18 15:57:22 +0000 2020,1215401761411870721,0,"We have let a bribing, colluding, coverup Trump walk away. I think these folks are safe don’t you ?",,
Tue Feb 18 15:57:22 +0000 2020,1203766174707785728,0,If anyone knows about illegal shit that would b you,,
Tue Feb 18 15:57:22 +0000 2020,788385768544829440,0,"@realDonaldTrump Por favor pelucón permitale a su marioneta @LuisLacallePou invitar a Venezuela, Cuba y Nicaragua el 1 de marzo.",@realDonaldTrump @LuisLacallePou,
Tue Feb 18 15:57:21 +0000 2020,2460493237,0,Have no hate! Good to know about the official copy. Thx!,,
Tue Feb 18 15:57:21 +0000 2020,908671244232531975,0,"Democracy is now dying slowly in ur reign America the whole world is imitating in everything is now another thing, Mr president wake up",,
Tue Feb 18 15:57:21 +0000 2020,82696988,0,"Dude, ease up on the make-up and tight clothes. You appear like a male Tammy Faye Bakker. It weakens your arguments considerably. Just. Stop.",,
Tue Feb 18 15:57:21 +0000 2020,929539621779677184,0,"You can resign now, you have dementia, it’s getting noticeably worse daily. Quit now , maybe you can make a deal to stay out of prison!",,
Tue Feb 18 15:57:21 +0000 2020,62839633,0,pic.twitter.com/VSxSUbbxcV,,
Tue Feb 18 15:57:21 +0000 2020,1229123451157303301,0,https://youtu.be/wm4grNE9QVg,,
Tue Feb 18 15:57:20 +0000 2020,38318665,0,Shut up Charlie! Then Rudy Giuliani has NO business going over to Ukraine to conduct any business on behalf of @realDonaldTrump. You and you friends at @TPUSA are know-nothing idiots. #TrumpIsACorruptLiar,@realDonaldTrump @TPUSA,#TrumpIsACorruptLiar
Tue Feb 18 15:57:20 +0000 2020,1189029674824978432,0,This is the CUTEST PICTURE EVER!!!!!!,,
Tue Feb 18 15:57:20 +0000 2020,1146077010558619650,0,Rough year for @CoryBooker Newark is a shit hole Nobody liked your campaign Donald Trump is your president Turned his GF away from penis Pure Beta #sparta #RosarioDawson #trump https://twitter.com/TheAdvocateMag/status/1229814067386146822 …,@CoryBooker,#sparta #RosarioDawson #trump
Tue Feb 18 15:57:20 +0000 2020,865648672343678977,0,pic.twitter.com/9ZKeJxuxnk,,
Tue Feb 18 15:57:20 +0000 2020,1153922793320456196,0,Lmaooo hydrative assault,,
Tue Feb 18 15:57:20 +0000 2020,246636485,0,What’s up? Getting nervous? Didn’t like being called fat my Mike?,,
Tue Feb 18 15:57:20 +0000 2020,154129921,0,@realDonaldTrump #MAGA #KAG2020LandslideVictory #AmericaFirst @RandPaul @TuckerCarlson @IngrahamAngle @RepMarkMeadows @Jim_Jordan @KellyannePolls @T_S_P_O_O_K_Yhttps://twitter.com/TheLastRefuge2/status/1229886564987232268 …,@realDonaldTrump @RandPaul @TuckerCarlson @IngrahamAngle @RepMarkMeadows @Jim_Jordan @KellyannePolls @T_S_P_O_O_K_Yhttps,#MAGA #KAG2020LandslideVictory #AmericaFirst
Tue Feb 18 15:57:19 +0000 2020,1007839865822687232,0,Crap,,
Tue Feb 18 15:57:19 +0000 2020,828067074266247168,0,Do you know how ridiculous you sound?,,
Tue Feb 18 15:57:19 +0000 2020,1222555298491224064,0,So preoccupied with size. Stormy said you do have a size problem,,
Tue Feb 18 15:57:19 +0000 2020,115380792,0,End federal dollars to ANY educational institution today. How? Make the least amount of money on paper as you possibly can. If you can afford to drop out of the market - do it. And don't sell your businesses. Just kill them outright.,,
Tue Feb 18 15:57:19 +0000 2020,965591988786446338,0,@realDonaldTrump corruption grows daily. Today’s news; clemency for a tax cheat & a disgraced governor who tried to sell a Senate seat; the latter’s family contributed to trump’s campaign. We might not get trump now but he & all of his family will be fair game soon. #SDNY,@realDonaldTrump,#SDNY
Tue Feb 18 15:57:19 +0000 2020,1200117762280034304,0,"I WISH VERY,VERY HAPPY,POWERFUL,POWERFUL,PRESTIGIOUS BIRTH DAY TO DONALD TRUMP 3RD KINDS SON OF YOU OR MR. @DonaldJTrumpJr KINDS ELDEST SON OF USA HOW HON PRESIDENT @realDonaldTrump SIR OF UNITED STATES!!!!!",@DonaldJTrumpJr @realDonaldTrump,
Tue Feb 18 15:57:19 +0000 2020,1652693330,0,"Let’s no start talking about our hopes now. That can get real dark, real fast. #IHaveHopesToo",,#IHaveHopesToo
Tue Feb 18 15:57:19 +0000 2020,2613852356,0,"MSM believing, hoax and conspiracy theory spreading, bias, activist Democrats are so out of touch with middle America,and are just too ignorant to realize, that because they choose to see us the way this article describes,they created a movement that gave us Donald J Trump...",,
Tue Feb 18 15:57:19 +0000 2020,4838119974,0,Notice how you’re talking about a completely different situation because you’ve got nothing for this one.,,
Tue Feb 18 15:57:19 +0000 2020,767147618875109376,0,pic.twitter.com/ZdYfIVpDcj,,
Tue Feb 18 15:57:18 +0000 2020,2885239648,0,AND the First ACQUITTED FOR LIFE!!,,
Tue Feb 18 15:57:18 +0000 2020,242030575,0,And as long as people like you don’t live here I am fine with that,,
Tue Feb 18 15:57:18 +0000 2020,495189090,0,These memes are too much,,
Tue Feb 18 15:57:18 +0000 2020,2842355490,0,pic.twitter.com/q7lpyCJYXm,,
Tue Feb 18 15:57:18 +0000 2020,860507444,0,Tubby Trump,,
Tue Feb 18 15:57:18 +0000 2020,1543676118,0,"Oh, really nutbag? Answer this where IS he getting the money from? He's also kicked people off their land in order to build the fence. Look it up. Google it. Its not a secret taking money from military 2x's",,
Tue Feb 18 15:57:18 +0000 2020,103034167,0,You’re welcome Mr President! Last week I went to the courthouse and officially updated my party affiliation to Republican. I felt a deep sense of satisfaction and look forward to casting my vote for you!!! KAG 2020!,,
Tue Feb 18 15:57:18 +0000 2020,1173465843642109952,0,I’m getting the sense here when roger stone is sentenced he’s going to be your boogeyman,,
Tue Feb 18 15:57:18 +0000 2020,1223054618000855040,1,Adas please do some fact checking. The most brazen scam in political history involves Russia meddling in the 2016 election. And by the way welcomed by the Orange Egotistical lying corrupt wanna be king.,,
Tue Feb 18 15:57:18 +0000 2020,42145851,0,Throwing hot coffee on people and getting in there face is far beyond their rights of free speech.,,
Tue Feb 18 15:57:18 +0000 2020,1165237227489767432,0,"okay and I've been clean for three years, what's your point?",,
Tue Feb 18 15:57:18 +0000 2020,797133264716754944,0,pic.twitter.com/CHsq97FnyO,,
Tue Feb 18 15:57:17 +0000 2020,514024883,0,"A draft dodger, putting a patriot down!! You may not want a reelection @realDonaldTrump but you can bet we will go through all legal channels to ensure you pay for the crime of have committed against America!! https://twitter.com/maddow/status/1229882591718887426 …",@realDonaldTrump,
Tue Feb 18 15:57:17 +0000 2020,1115860021051568130,0,It isn’t higher than 50% because not everyone is gullible enough to believe that you actually love America and to believe the tornado of bullshit that comes out of your mouth.,,
Tue Feb 18 15:57:17 +0000 2020,1227326253541183488,0,Trump has no liquidity.,,
Tue Feb 18 15:57:17 +0000 2020,1192029678128766977,1,Será Trump la salvación del pueblo venezolano (y español)? La basura de Sánchez ocultará a Maduro a cambio del oro?,,
Tue Feb 18 15:57:17 +0000 2020,495990955,0,Don’t hold your breath. They csre more about maintaining control. The truth matters NOT.,,
Tue Feb 18 15:57:17 +0000 2020,1206994590269607942,0,"When you are obese, you can't really make fun of shorter people.... And by the way, everyone knows you are barely 6'2 & only because of the heels you wear!!!",,
Tue Feb 18 15:57:17 +0000 2020,781597663015890944,0,@realDonaldTrump U know really its a case of hats off to Blago’s wife. She has really stuck by him thick and thin. Must be a great person.,@realDonaldTrump,
Tue Feb 18 15:57:17 +0000 2020,265570564,0,You liberals really hate facts.,,
Tue Feb 18 15:57:17 +0000 2020,1568834400,0,Why didn’t you shoot ppl that’s ya thing when you feel threatened right?,,
Tue Feb 18 15:57:17 +0000 2020,229900964,0,If you Want to see gun legislation change— POC NEED to start buying firearms - check History- it has happened Several times Already,,
Tue Feb 18 15:57:17 +0000 2020,575056720,1,,,
Tue Feb 18 15:57:16 +0000 2020,1019986716155957254,0,"@POTUS, More than the hatred they have for you, THEY fear you! Most importantly, they fear your confidence and know they have none. For, even, THEIR display of ""confidence"" is FAKE! #Mockingbird #FakeNews #CoolestPOTUS #Qanon",@POTUS,#Mockingbird #FakeNews #CoolestPOTUS #Qanon
Tue Feb 18 15:57:16 +0000 2020,28244047,0,Andy is ate up with TDSpic.twitter.com/hfAdN1DVvF,,
