timestamp,Username,Retweets,Text,Mentions,Hashtags
Tue Feb 18 15:55:22 +0000 2020,809193815936335872,0,"If you elect the Democratic Party, you would literally help save lives. #Medicare4All @DNC @realDonaldTrump had the House & Senate for 2 years to fix this issue. The @GOP does not care if you have health care or not.https://twitter.com/YaleSPH/status/1228295385359278080 …",@DNC @realDonaldTrump @GOP,#Medicare4All
Tue Feb 18 15:55:22 +0000 2020,1651466042,0,pic.twitter.com/xnzIlo1fnd,,
Tue Feb 18 15:55:22 +0000 2020,977335083517562885,2,"Yeah, He seems like one of your cronies, fine upstanding patriot.pic.twitter.com/Rl2hwV10ku",,
Tue Feb 18 15:55:21 +0000 2020,2398365282,0,If anyone would know a phony.,,
Tue Feb 18 15:55:21 +0000 2020,270519813,0,Go get em,,
Tue Feb 18 15:55:21 +0000 2020,1215751518042771457,0,I just wanna make sure we are on the same page these are not kids. Full grown collage adults.,,
Tue Feb 18 15:55:21 +0000 2020,728496573936750593,0,"I know, it's poetic.",,
Tue Feb 18 15:55:21 +0000 2020,947481865803522049,1,"With all of her obvious and bizarre mental problems which were accurately described through all of the previous tweets, the reality is that this nutcase needs to be removed from her office as soon as possible. In the upcoming primary, vote Republican and make it happen!",,
Tue Feb 18 15:55:21 +0000 2020,16387628,0,Nixon was a much more skillful crook who had actually served in the military (and maybe screwed fewer whores) CAN'T TRUST TRUMP! #investigate #indict #incarcerate @POTUS failing fakepresident @realDonaldTrump corruption mismanagement incompetence,@POTUS @realDonaldTrump,#investigate #indict #incarcerate
Tue Feb 18 15:55:20 +0000 2020,19665977,0,Impeachment had nothing to do with the crimes he was named as unindicted coconspirator or individual 1.,,
Tue Feb 18 15:55:20 +0000 2020,1062020225015648257,0,Bless your heart.,,
Tue Feb 18 15:55:20 +0000 2020,1036046868357115904,0,Y’all think white people are racist Call a Puerto Rican “Mexican” and ooooooooh shit all of a sudden they Donald Trump,,
Tue Feb 18 15:55:20 +0000 2020,997536191548481536,0,pic.twitter.com/h8ahCBDb4t,,
Tue Feb 18 15:55:20 +0000 2020,1605945871,0,Trump pardons Blago Blago comes over and helps Trump with his hair.,,
Tue Feb 18 15:55:20 +0000 2020,3032019214,0,"I won’t, you’ll have to grow up like the rest of us, instead of having to throw a tantrum any time you see someone with a different view than yours.",,
Tue Feb 18 15:55:20 +0000 2020,833446856545800193,0,Shut up Donnie! You are not the king or the dictator of this country,,
Tue Feb 18 15:55:20 +0000 2020,8308222,0,I'm more than capable of agreeing to disagree. But not on the mistreatment of refugees. I came to America legally as a refugee and you aren't going to change that. Much like you aren't going to change that you came from privileged origins in Mexico. You need empathy.,,
Tue Feb 18 15:55:20 +0000 2020,1175291437388357633,0,Amennnn....but then trumps IQ is only 73 so he has a hard time being a stable genius lol,,
Tue Feb 18 15:55:20 +0000 2020,48650395,17,We’re not going to guilt trip MAGAland into not voting for Donald Trump. They look at him as a fantasy of white excellence and revel in his ability to do or say whatever he wants like a drunken frat boy Viking with a goblet and giant turkey leg in his hand,,
Tue Feb 18 15:55:20 +0000 2020,965016448161558528,0,"I love the ""Pretenders"" music, and now I have another reason to love the Pretenders - You're an American Patriot !pic.twitter.com/tZxiiqZon4",,
Tue Feb 18 15:55:20 +0000 2020,1222158928995344384,0,You’re just pissed because he has more money than you!,,
Tue Feb 18 15:55:19 +0000 2020,4741317860,0,"The globalist gave you black Ken and Barbie, that’s about it.",,
Tue Feb 18 15:55:19 +0000 2020,1204775349994823680,0,Feeling threatened doesn't trump a constitutional right to open carry,,
Tue Feb 18 15:55:19 +0000 2020,1202243413,0,Exactly .... he wants to profit off of this country like trump does. It’s disgusting and his base are extremely ignorant and toxic. Supporting corruption and criminal behavior. The hypocrisy too when they go after Trump for the same things @MikeBloomberg embodies.,@MikeBloomberg,
Tue Feb 18 15:55:19 +0000 2020,980547405387984896,2,IFBP @LRevaewpic.twitter.com/MrdbfKZkiR,@LRevaewpic,
Tue Feb 18 15:55:19 +0000 2020,2561826685,0,Yep only white cockroaches,,
Tue Feb 18 15:55:19 +0000 2020,39132044,0,Sarcasm in my last Tweet,,
Tue Feb 18 15:55:19 +0000 2020,1079175376956321792,0,Good wins.,,
Tue Feb 18 15:55:18 +0000 2020,1226451789022519296,0,"trump's sister gave up a life time judicial seat to AVOID an ethics investigation! no one gets to see @POTUS's financial anything! Why!? trump is a crook, that's why",@POTUS,
Tue Feb 18 15:55:18 +0000 2020,1007076785798823936,0,it’s what’s you deserve sweet heart <3,,
Tue Feb 18 15:55:18 +0000 2020,511093493,0,So true. I remember when I had to loan you $5 for KFC,,
Tue Feb 18 15:55:18 +0000 2020,465130521,0,pic.twitter.com/0FxgFMghoA,,
Tue Feb 18 15:55:18 +0000 2020,4799547080,0,1) you're not a lawyer 2) there is a process called voir dire. This process allows defense to Challenge jurors 3) Pretty sure this isn't grounds for dismissal 4) you're still a TRAITOR,,
Tue Feb 18 15:55:18 +0000 2020,399941839,0,"@POTUS @realDonaldTrump Need to vote against this President, crying wolf lying about opioid death being from prescription not IMH/IMF. Ppl are suffering, are #killing themselves ,>41a day thanks to @realDonaldTrump needing to claim he solved a problem.",@POTUS @realDonaldTrump @realDonaldTrump,#killing
Tue Feb 18 15:55:18 +0000 2020,1132284539487903744,0,Is this like when Republican Candidate Nixon contacted the S Vietnamese leaders to not negotiate a peace treaty in 1968 until he was elected so they would get a better “deal”? Asking for a few thousand dead soldiers because of that #MAGA,,#MAGA
Tue Feb 18 15:55:17 +0000 2020,56356790,0,WHY DON'T YOU POST A PICTURE OF THE ONLY BLACK PRESIDENT IN U.S. HISTORY? IT IS BLACK HISTORY MONTH......BROTHA!!!!,,
Tue Feb 18 15:55:17 +0000 2020,2683693964,0,Damn that looks scary. Did you shit your pants?,,
Tue Feb 18 15:55:17 +0000 2020,886724737858232321,7,Bloomberg is a Mini version of George Soros.,,
Tue Feb 18 15:55:17 +0000 2020,1015296130249211904,0,#TrumpIsChildishAndChicken,,#TrumpIsChildishAndChicken
Tue Feb 18 15:55:17 +0000 2020,819432233450602496,0,Hilarious,,
Tue Feb 18 15:55:17 +0000 2020,1137390055192977409,0,Dawn honey he won't do that because the truth would come out and show how much of a crook he really is.,,
Tue Feb 18 15:55:17 +0000 2020,330847972,0,"Psssst, Andy... Donald Trump is doing is the same thing he did in 2016... pointing out the DNC and its media pals attempting to steal the nomination from Sanders. He is priming things to lure disgruntled voters to him in case the DNC, et al succeeds. It will likely work too! pic.twitter.com/AeFR6YtbIR",,
Tue Feb 18 15:55:17 +0000 2020,1148372244,0,"There are elements of fascism. That is a fact. You may want to ignore how these actions are fascist, but the Facts are that this crowd was full of fascists, doing fascist tactics. Are you late for your antifa meeting?",,
Tue Feb 18 15:55:16 +0000 2020,1214211801052676098,0,why democrat goes behind your back and speak to terrorist regime of iran they didnt see how many iranian been killed how can they come on live tv show and tell lie to people face how traitor is Democrat are and been and will be how can they come on tv and talking a bout democrac,,
Tue Feb 18 15:55:16 +0000 2020,2708293879,0,Impeached loser,,
Tue Feb 18 15:55:16 +0000 2020,88336048,0,Doubt that actually happened,,
Tue Feb 18 15:55:16 +0000 2020,900138015682592770,1,We got another one jumping the fence,,
Tue Feb 18 15:55:16 +0000 2020,710454488222531584,0,Research the last Administration’s contribution to the national debt,,
Tue Feb 18 15:55:16 +0000 2020,558274539,1,Actually obama took that title from Carter. Trump 2020 believe it.,,
Tue Feb 18 15:55:16 +0000 2020,1158202031238258692,0,Then lets look at the other jurors Seth Cousins and the rest.,,
Tue Feb 18 15:55:16 +0000 2020,1010359841443991557,2,Thank you so very much for the ride. It is very much appreciated. I'm always happy to follow patriots. IFB,,
Tue Feb 18 15:55:16 +0000 2020,16704363,0,The dossier is not totally discredited.,,
Tue Feb 18 15:55:15 +0000 2020,336293275,2,How tall is your prime sycophant @RandPaul? Not as tall as @MikeBloomberg when mike stands on his wallet I bet.,@RandPaul @MikeBloomberg,
Tue Feb 18 15:55:15 +0000 2020,780852377670692864,0,"LMAO Again, thank you for showing us how incredibly STUPID you really are.",,
Tue Feb 18 15:55:15 +0000 2020,1938921966,0,@realDonaldTrump the BS meter is off the charts!,@realDonaldTrump,
Tue Feb 18 15:55:15 +0000 2020,163308998,0,Why hasn't @SecPompeo @KerriKupecDOJ @TheJusticeDept @FBI @CIA ARRESTED them?? Too busy manufacturing crimes against All the Presidents Men instead? Just like corrupt COUP klan #LisaPage said! This is PURE SEDITION/TREASON. WTP have a duty/right to remove rogue corrupt governmnt,@SecPompeo @KerriKupecDOJ @TheJusticeDept @FBI @CIA,#LisaPage
Tue Feb 18 15:55:15 +0000 2020,145305444,0,What a disgrace,,
Tue Feb 18 15:55:15 +0000 2020,1148752548813316096,0,Our president functions at the level of a 7th grade boy. Sad days indeed.,,
Tue Feb 18 15:55:15 +0000 2020,1079207604402962432,0,Blago deserved to serve his full term. Kerik..I'm on the fence with him,,
Tue Feb 18 15:55:15 +0000 2020,29063161,0,Keep fighting and Sharpen your knowledge of Bloomberg and how He works! He’s the devil,,
Tue Feb 18 15:55:15 +0000 2020,1226244463778988033,0,LIAR!,,
Tue Feb 18 15:55:15 +0000 2020,250559176,0,"Bye, Fred.pic.twitter.com/KzbhdOz6vh",,
Tue Feb 18 15:55:15 +0000 2020,634271280,0,"That’s all the good you can find, Scott?",,
Tue Feb 18 15:55:14 +0000 2020,2879575861,0,That is why your state is a s*** hole! JS,,
Tue Feb 18 15:55:14 +0000 2020,1094489639065391104,0,You're never gonna blow Trump's little shroom.,,
Tue Feb 18 15:55:14 +0000 2020,272074959,0,@realDonaldTrump https://twitter.com/TheRickWilson/status/1229891644016799744 …,@realDonaldTrump,
Tue Feb 18 15:55:14 +0000 2020,1025261955617939456,0,Heather Heyer.,,
Tue Feb 18 15:55:14 +0000 2020,1117869398,0,Our climate change / AI era has changed the investment strategies of major players worldwide. This will continue to play out in private industry and government policy making decisions. We are looking at an evolving economy.,,
Tue Feb 18 15:55:13 +0000 2020,2890235663,0,"It’s not even just because you’re a trump supporter. You’re a terrible person, period. Nobody should have to tolerate your toxicity.",,
Tue Feb 18 15:55:13 +0000 2020,830157192733016068,0,"I gave it a D only because he has inspired more people to pay attention. Otherwise, nothing redeemable.",,
Tue Feb 18 15:55:13 +0000 2020,2200235154,14,GOD BLESS @realDonaldTrump. @AliceMarieFree WELL DONE HELPING TO FREE 3 WOMEN TODAY Judith Negron Crystal Munoz Tynice Nichole Hall All had their sentences commuted today by the president of the United States and these are the names America does it get to know.,@realDonaldTrump @AliceMarieFree,
Tue Feb 18 15:55:13 +0000 2020,890720573449306113,0,pig,,
Tue Feb 18 15:55:13 +0000 2020,3248801416,0,"NOT,",,
Tue Feb 18 15:55:13 +0000 2020,47769424,0,Like Eric Holder saying he was Obama's wingman? I'm not seeing you had a problem with that.,,
Tue Feb 18 15:55:13 +0000 2020,36685954,0,Who needs the Russians when DNC can do the job? #maga #kag #kag2020 #walkaway @realDonaldTrump https://twitter.com/realDonaldTrump/status/1229871184193282048 …,@realDonaldTrump,#maga #kag #kag2020 #walkaway
Tue Feb 18 15:55:13 +0000 2020,245945434,0,@POTUS @realDonaldTrump https://twitter.com/atrupar/status/1229780637374144514 …,@POTUS @realDonaldTrump,
Tue Feb 18 15:55:12 +0000 2020,917166430579232769,0,@realDonaldTrump,@realDonaldTrump,
Tue Feb 18 15:55:12 +0000 2020,764952531650744321,0,Duffy. Trump. Oh yeah. We're off to a great start.,,
Tue Feb 18 15:55:12 +0000 2020,43833779,0,Trump 2020,,
Tue Feb 18 15:55:12 +0000 2020,26681872,0,"It sounds like you are threatened by Mike Bloomberg, tRUMPy! I hope you can’t sleep at night.",,
Tue Feb 18 15:55:12 +0000 2020,1052485817808146432,0,Hmmm yeah didn’t see you protest the same when the trump supporting nazis showed up in Charlottesville and actually murdered someone! pic.twitter.com/bAiKXcirZ9,,
Tue Feb 18 15:55:12 +0000 2020,35492307,0,"Dear Diary, @realDonaldTrump still won't let us know who anonymous is....",@realDonaldTrump,
Tue Feb 18 15:55:12 +0000 2020,1190799449347379200,0,Oh I love this...pic.twitter.com/5y4mcTStCP,,
Tue Feb 18 15:55:12 +0000 2020,3160455490,0,You are riding on his coat tails.,,
Tue Feb 18 15:55:12 +0000 2020,283296949,0,Press Secy who doesn't do press briefings for King Trump. #BlueWave2020,,#BlueWave2020
Tue Feb 18 15:55:11 +0000 2020,2334516992,0,"You can speak of payoffs, it's one area of business where we all know you do have experience!",,
Tue Feb 18 15:55:11 +0000 2020,95243144,0,Touch a nerve did we. Thanks for keeping up the good work that Obama started.,,
Tue Feb 18 15:55:11 +0000 2020,35029227,0,By definition then that means ppl at Trump rallies are terrorists fro pumching and harrassing counter protesters. Everyones a terrorist!,,
Tue Feb 18 15:55:11 +0000 2020,18787381,0,I do not worship Q but I have read every post and followed the links provided. Anyone who has is well informed. If you are so curious about what is coming I suggest you do the same. It is extremely complex and involves many people. It goes right to the top (Obama).,,
Tue Feb 18 15:55:11 +0000 2020,254952261,0,Gun violence is a different debate. She was doing President Trivia because of President Day. She has done trivia before episodes before. The leftist snowflakes took it to the level that it got too. This was not her fault in anyway.,,
Tue Feb 18 15:55:11 +0000 2020,1162525032465293313,0,pic.twitter.com/5MPIt3uHTZ,,
Tue Feb 18 15:55:11 +0000 2020,1164135965780303872,0,That is in SUCH BAD TASTE... and SO DAMN FUNNY. L O L,,
Tue Feb 18 15:55:10 +0000 2020,139783157,0,You would know wouldn't you since you the master at all things criminal!!,,
Tue Feb 18 15:55:10 +0000 2020,2332805154,0,"And if Trump was anything but POTUS , he would be in jail like Blagojevich is/was. This is fucked up.",,
Tue Feb 18 15:55:10 +0000 2020,249056189,0,#CarnivalBarkingClownpic.twitter.com/bIZuvyfSWu,,#CarnivalBarkingClownpic
Tue Feb 18 15:55:10 +0000 2020,354410140,0,What policy was set in place in 2010 to cause economic expansion? @GOP @realDonaldTrump,@GOP @realDonaldTrump,
Tue Feb 18 15:55:10 +0000 2020,2355650738,4,"We had Bill Clinton and Donald Trump, and I think that’s enough. We don’t need to elect a third person from Jeffrey Epstein’s little black book— Michael Bloomberg— president.",,
Tue Feb 18 15:55:10 +0000 2020,1071563144,0,I am happy you are willing to take the backlash. I have seen the impact of Presidents economic policies have had on my family who started out fighting to get decent jobs and pay! No one is on welfare and everyone feels good about their tax returns. Its all caring about the USA.,,
Tue Feb 18 15:55:09 +0000 2020,2444573142,4,"Scott, you are the epitome of all that is good in this world! You are a national treasure! I hope that @EricaAmerica23 and I can see you when you come to Pittsburgh! We are ready to re-elect @realDonaldTrump on November 3, 2020! #KAG #MAGA",@EricaAmerica23 @realDonaldTrump,#KAG #MAGA
Tue Feb 18 15:55:09 +0000 2020,936726637600804864,0,"He is just advising them of their rights. They have the right to remain silent, just as you have the right to remain silent, so, STFU.",,
Tue Feb 18 15:55:09 +0000 2020,1011338915599577088,0,"Why haven’t they shut down air travels in the US ?? I mean it’s only our life at stake..no biggie huh @realDonaldTrump get with the program , shut that shit down before we’re all dead ! I voted for you fore a reason Don’t let your followers down , My life is important.",@realDonaldTrump,
Tue Feb 18 15:55:09 +0000 2020,1073799625,0,"They voted against opening an impeachment inquiry 3 times before they finally did it. So, no. Besides, there's no ""trying"" to impeach. Dems have majority, they could've done it as soon as they took over the house. Martha, it's very sad what you've become. I'm embarrassed for you",,
Tue Feb 18 15:55:09 +0000 2020,151721726,0,hay que triturar a la dictadura,,
Tue Feb 18 15:55:09 +0000 2020,1121639253891375104,0,"Tired of all this? Well then do something about it. Call 586.260.3220 say I'll run against leftists' news TV like NBC and CNN, expose leftists Democrats Pelosi Schiff Schumer etc. ProLife Democrats Association (PDA) will help you in US CONGRESS 2020 PRIMARY! Call 586.260.3220",,
Tue Feb 18 15:55:09 +0000 2020,719096594,0,Too true - the anti american trump bots couldn't wait to desecrate America their hatred of the USA is way out of bounds and makes them traitors,,
Tue Feb 18 15:55:09 +0000 2020,21714879,0,"Trump thinks the supporters overlap because of trade deals so he can woo us if Bernie is somehow beaten by Bloomberg. Beating Bloomberg is so easy. All they have for Bernie is ""communist"" which they will use for all other candidates except for Bloomberg.",,
Tue Feb 18 15:55:09 +0000 2020,19212271,0,Right. Let out some more of your criminal buddies ok?,,
Tue Feb 18 15:55:09 +0000 2020,1137787854967451648,0,But were the people who said those wrong?,,
Tue Feb 18 15:55:08 +0000 2020,912323392073846785,0,https://demolay.org/,,
Tue Feb 18 15:55:08 +0000 2020,1008284621191036928,0,Andy with the consistent idiot posts,,
Tue Feb 18 15:55:08 +0000 2020,15141586,0,https://twitter.com/soledadobrien/status/1229793596133531649?s=21 …,,
Tue Feb 18 15:55:08 +0000 2020,269940084,0,"You don't want to run against anyone - you only want to get ""elected"" the Putin way. Rigged voting.",,
Tue Feb 18 15:55:08 +0000 2020,1221176529138438144,0,@CIA @realDonaldTrump @DEAHQ,@CIA @realDonaldTrump @DEAHQ,
Tue Feb 18 15:55:08 +0000 2020,803696112410513408,0,@realDonaldTrump bettt,@realDonaldTrump,
Tue Feb 18 15:55:08 +0000 2020,921771507185078273,0,"What are you waiting for? Lay it on us, daddy-o.",,
Tue Feb 18 15:55:08 +0000 2020,889495475476475910,1,C cup. And red. Putin likes when he wears red.,,
Tue Feb 18 15:55:08 +0000 2020,1036960803352727552,0,if it aint broke why fix it?,,
Tue Feb 18 15:55:08 +0000 2020,1217830513928478720,0,White collar criminals have nothing on the baby rapers that were released by obummer and Clinton,,
Tue Feb 18 15:55:08 +0000 2020,2176969314,0,Bringing AR-15s on school campuses is a little fucking weird.,,
Tue Feb 18 15:55:08 +0000 2020,3680075848,0,"Students have a voice too, they can stand up, give speeches of their own, and denounce what she says. Riots aren’t the answer, and I’m not going to give them any more money until I know they’re creating a safe environment for everyone’s free speech.",,
Tue Feb 18 15:55:07 +0000 2020,1119254852192931840,0,"Bloomberg doesn’t hide his height or anything else, unlike you, with tarted up hair, ridiculous makeup, tanning, corset... who knows what? Mr. Insecurity!",,
Tue Feb 18 15:55:07 +0000 2020,4407043294,0,LMAO,,
Tue Feb 18 15:55:07 +0000 2020,473025731,2,Sounds like Kerry & Murphy may have possibly violated the Logan Act. They need to be investigated & charged (or not) accordingly.pic.twitter.com/X0wn6mGuCZ,,
Tue Feb 18 15:55:07 +0000 2020,4035280701,0,"Poor Penny, they didn’t teach history in her school.",,
Tue Feb 18 15:55:07 +0000 2020,1195735022864674817,0,"To defend the COUNTRY....not one ""stable genius"" man that thinks article 2 says he can do whatever he wants....king trump #justsaying",,#justsaying
Tue Feb 18 15:55:07 +0000 2020,2760041439,0,pic.twitter.com/t1AZmDeoSF,,
Tue Feb 18 15:55:07 +0000 2020,910914910238003201,0,And Roger Stone will be wrongly pardon by the self proclaim highest law enforcement officer Donald Trump by Thursday afternoon.,,
Tue Feb 18 15:55:07 +0000 2020,1220095936916942854,0,pic.twitter.com/IX41AXZfNW,,
Tue Feb 18 15:55:07 +0000 2020,48162703,0,Of course he didpic.twitter.com/DqlH9griVk,,
Tue Feb 18 15:55:07 +0000 2020,1127963114639699969,0,"Ideolagical segregation is ugly, they should do a new version of ” Remember The Titans ”",,
Tue Feb 18 15:55:06 +0000 2020,113438003,0,That's @realDonaldTrump!! https://twitter.com/NoahShachtman/status/1229836385575669760 …,@realDonaldTrump,
Tue Feb 18 15:55:06 +0000 2020,32276209,0,"A partisan acquittal is no acquittal at all. And for the first time in history, a member of the president's own party voted to convict and remove.",,
Tue Feb 18 15:55:06 +0000 2020,2172930018,0,Dont start the race shit. She is an immature girl that wanted action. She got it.,,
Tue Feb 18 15:55:06 +0000 2020,1204153522918436872,0,Is that among Republicans? I guess even they have had enough of you.,,
Tue Feb 18 15:55:06 +0000 2020,377742952,0,rarely shared truth from a compulsive liar,,
Tue Feb 18 15:55:06 +0000 2020,816337252905316353,0,"I can’t sympathize, I hate that the world chooses to react with such violence it’s honestly disgusting to watch, but I’d say that about any similar situation. I’m sorry this happened, but Is it so hard to pick a president who gives a fuck about the Earth? “Mars 2020” Yeah Okay.",,
Tue Feb 18 15:55:06 +0000 2020,1078357172780716033,0,MAKE AMERICA GREAT AGAIN! IMPEACH DONALD ROUND TWO!,,
Tue Feb 18 15:55:06 +0000 2020,456865788,18,DICTATORIAL DONALD Trump’s expansive view of executive power gets a post-impeachment surge http://ow.ly/HvOi30qiFgE via @politico & @davidhorsey @taradublinrocks @expectsuccess @trumpdictionary @AKADonaldTrump @PrincessBravato @PrissyCrow @Infantry0300 @marisac721 @putinsclownpic.twitter.com/f7qjblMqoB,@politico @davidhorsey @taradublinrocks @expectsuccess @trumpdictionary @AKADonaldTrump @PrincessBravato @PrissyCrow @Infantry0300 @marisac721 @putinsclownpic,
Tue Feb 18 15:55:06 +0000 2020,826158230992723968,0,"Wait, didn't you buy the election from PUTIN?",,
Tue Feb 18 15:55:06 +0000 2020,900582844296081408,0,https://www.forbes.com/sites/michelatindera/2019/11/22/heres-why-michael-bloomberg-is-17-times-richer-than-donald-trump/amp/ … I highly doubt he cares what you think at least he’s not a faker & wear lifts and two padded shoulder pads,,
Tue Feb 18 15:55:06 +0000 2020,825683589526351872,3,"To defeat Donald Trump on November 3, 2020 the Democratic Party must #VoteBlueNoMatterWho2020 . Do you agree or disagree? Please vote & RT",,#VoteBlueNoMatterWho2020
Tue Feb 18 15:55:05 +0000 2020,951630300198719488,0,That’s how you drain it! You empty it by giving your friends a Hand and Pull then OUT! See! EMPTY! TaDa!!!,,
Tue Feb 18 15:55:05 +0000 2020,1353186810,0,Hot topic? Because I’m wearing a black V neck from H&M in my profile pic? If you gonna clapback at people make sure you get your facts right. No wonder you gotta make gaming videos for that 1¢ a week,,
Tue Feb 18 15:55:05 +0000 2020,1150938103848349696,1,Just like you shielded these conman #TrumpPardons https://twitter.com/samstein/status/1229895101746483201?s=21 …https://twitter.com/samstein/status/1229895101746483201 …,,#TrumpPardons
Tue Feb 18 15:55:05 +0000 2020,823873291895115776,2,The @UN needs to go. They're all corrupt and nothing but elite globalists pushing for a One World Government. Climate change is the biggest scan of the century. This is complete BS. @realDonaldTrump pull us out of this corrupt organization.,@UN @realDonaldTrump,
Tue Feb 18 15:55:05 +0000 2020,4801111393,1,pic.twitter.com/kBiIXlc8Od,,
Tue Feb 18 15:55:05 +0000 2020,25613863,0,"Don’t worry, we’ll pick the right candidate. At least his money enters the economy - people get jobs, money gets spread around. When you do it, it goes right into your pockets.",,
Tue Feb 18 15:55:05 +0000 2020,1218685744333643776,0,Tru,,
Tue Feb 18 15:55:04 +0000 2020,1178727882736259072,0,"Give us one small item, I don't think Sanders would win anyway. Everything he proposes just can't get it passed. I want medical records in order for him to get my vote.",,
Tue Feb 18 15:55:04 +0000 2020,1005096014687195136,0,All these kids had to do was peacefully ignore her and she would’ve eventually left with no evidence or content to post... that’s the best way to battle people like Kaitlin. Take away their platform. These kids gave her a platform... Now more people are going to vote trump...,,
Tue Feb 18 15:55:04 +0000 2020,23761911,0,He saved us from a depression. And most Americans know it except a couple do nothing GOPers like you.pic.twitter.com/VWQ4wM7E6S,,
Tue Feb 18 15:55:04 +0000 2020,17117882,0,"...and what's with the literally >=20 other poc endorsements he's gotten, michael nutter, sylvester turner, geoffrey canada, ted deutch, the list goes on and on. you're telling me all these poc leaders have become corrupted? i don't think so.",,
Tue Feb 18 15:55:04 +0000 2020,78087898,0,I love you President Trump please work hard and have your people in prayer for a new born again HOUSE of REPRESENTATIVES!!,,
Tue Feb 18 15:55:04 +0000 2020,2814044250,0,I hope you are jailed soon!,,
Tue Feb 18 15:55:04 +0000 2020,19748694,0,"@realDonaldTrump hey buddy, since you are taking recommendations on what to do with rich crooks, I’d like to recommend you resign. Please let me know your thoughts.",@realDonaldTrump,
Tue Feb 18 15:55:04 +0000 2020,1000156284,0,pic.twitter.com/Z089vi3tVx,,
Tue Feb 18 15:55:04 +0000 2020,561835971,3,RUDY IS A CRIMINAL STANDING UP FOR ANOTHER CRIMINAL! RUDY IS UNDER CRIMINAL INVESTIGATION RIGHT NOW AS WE SPEAK !!!,,
