timestamp,Username,Retweets,Text,Mentions,Hashtags
Tue Feb 18 15:53:05 +0000 2020,563147998,0,"You act like you’re being persecuted just because people recognize they don’t have to pretend to like you or Trump, because that’s what freedom of speech is",,
Tue Feb 18 15:53:05 +0000 2020,601423065,2,HE IS A CRIMINAL. Birds of a feather huh Choppers,,
Tue Feb 18 15:53:04 +0000 2020,16025262,0,Didn’t @realDonaldTrump do something similar? I’m guessing Nagle gets a pardon then? Lol https://twitter.com/DMAnews1/status/1229765871066849280 …,@realDonaldTrump,
Tue Feb 18 15:53:04 +0000 2020,1189296774005088256,0,y el pueblo pagando esa sanciones pasando roncha.,,
Tue Feb 18 15:53:04 +0000 2020,3287001583,0,You are IMPEACHED dude!Take a chill pill!,,
Tue Feb 18 15:53:04 +0000 2020,1158549492116992000,0,"Donald trump is not a bad president don't get me wrong ,but we need more Jim! for our future and our future kids ! Can we stop being selfish for one second and learn how to care for others that was born into the us soil and still getting ripped off ?",,
Tue Feb 18 15:53:04 +0000 2020,780852377670692864,0,LMAO,,
Tue Feb 18 15:53:04 +0000 2020,608694294,0,"Heres an illigal campaign contribution, ah hem,pic.twitter.com/39ltjKaTLA",,
Tue Feb 18 15:53:04 +0000 2020,3538222217,0,Love u @scottpresler President Trump Greatest President in US History Trump 2020,@scottpresler,
Tue Feb 18 15:53:04 +0000 2020,1096619810061012993,0,"So, what's your point. Does this prove something ? Guilty by association I guess... GO. D N.C. !!pic.twitter.com/ENKXEgf53W",,
Tue Feb 18 15:53:04 +0000 2020,107314373,0,Which of your crooked cronies’ trial are you talking about?,,
Tue Feb 18 15:53:04 +0000 2020,28471751,0,@realDonaldTrump @GOP @senatemajldr @LindseyGrahamSC #RIPGOP #Americaispissed #NovemberIsComing #girlbye #goodluckwiththathttps://twitter.com/middleageriot/status/1229884707564933124 …,@realDonaldTrump @GOP @senatemajldr @LindseyGrahamSC,#RIPGOP #Americaispissed #NovemberIsComing #girlbye #goodluckwiththathttps
Tue Feb 18 15:53:04 +0000 2020,470171162,0,"I watched every second of the inquiry AND the trial, honey. The inquiry produced the witnesses and evidence that confirmed Trump pushed a quid pro quo for personal reward. Abuse of power. And he obstructed Congress in 83 instances. Next up: pic.twitter.com/D1Tawa9rH1",,
Tue Feb 18 15:53:04 +0000 2020,1212769627291316224,0,"The only thing endangering the lives of the public IS YOU. Knock it off, this is not the KGB.",,
Tue Feb 18 15:53:03 +0000 2020,827366553091846144,1,On another note....pic.twitter.com/ceJjruRefN,,
Tue Feb 18 15:53:03 +0000 2020,835113387596054529,0,"Are you serious? You think the media is pushing for Bernie? You're more delusional than a Trump supporter, if that's what you think.",,
Tue Feb 18 15:53:03 +0000 2020,1227280464844664832,0,Lots of males with “soft hands” out there protesting.,,
Tue Feb 18 15:53:03 +0000 2020,538149299,0,Nothing is disqualifying anymore,,
Tue Feb 18 15:53:03 +0000 2020,529553787,0,Same media had no problem complaining about Trump turning the Daytona 500 into a campaign event.,,
Tue Feb 18 15:53:03 +0000 2020,1171285414545506304,0,pic.twitter.com/CbjMiRqe1A,,
Tue Feb 18 15:53:03 +0000 2020,1197261344829050881,0,@realDonaldTrump https://www.msnbc.com/morning-joe/watch/trump-takes-credit-for-gains-made-under-obama-78923333602 …,@realDonaldTrump,
Tue Feb 18 15:53:03 +0000 2020,257497216,0,"Thanks, Dickhead!pic.twitter.com/CzanAQ9ivW",,
Tue Feb 18 15:53:03 +0000 2020,985715556010614785,0,Lucky for Trump AND his supporters that they dont know what that big word means,,
Tue Feb 18 15:53:03 +0000 2020,3095463699,0,https://twitter.com/waltshaub/status/1229902573437669377?s=20 …,,
Tue Feb 18 15:53:03 +0000 2020,27710228,0,They don’t want you shitting your pants in their dorms.,,
Tue Feb 18 15:53:02 +0000 2020,3630728496,0,"“Schooling Tim Pool” has become my new favorite thread on twitter, thank you for your wisdom and the enlightening of the genius and brilliance of PDJT to those who just can’t see",,
Tue Feb 18 15:53:02 +0000 2020,1002247382916976640,0,"What?Do you have evidenced,other than accusations? I’d rather have President Trump who became rich before Being a President than voting someone who became millionaires When they are in office,selling America to other countries.",,
Tue Feb 18 15:53:02 +0000 2020,213167183,0,What a mini intellect you are.,,
Tue Feb 18 15:53:02 +0000 2020,2905991319,0,"Dude, shut up already. If you haven't noticed - nobody cares what you have to say.",,
Tue Feb 18 15:53:02 +0000 2020,197478658,0,There were how many men on that bus? Yes he should apologize. But not one of all those men had the balls to say @realDonaldTrump @POTUS that is a nasty vulgar thing to say. Not one and until men put a stop to it among themselves it isn’t going to stop those who are ignorant,@realDonaldTrump @POTUS,
Tue Feb 18 15:53:02 +0000 2020,86876271,1,God willing,,
Tue Feb 18 15:53:02 +0000 2020,570816898,0,Thread by @COsweda: Thread You know what almost nobody EVER acknowledges that @realDonaldTrump has? Agency. The capacity to act. I like Tim Put he has a Trump blind spot. @realDonaldTrump There's no doubt that Trump's Judas goats got Bloomberg into the r… https://threadreaderapp.com/thread/1229889645070049282.html …,@COsweda @realDonaldTrump @realDonaldTrump,
Tue Feb 18 15:53:01 +0000 2020,847037128584290304,0,Welp that didn’t work out so well did it!,,
Tue Feb 18 15:53:01 +0000 2020,1178716279328296960,0,Nope,,
Tue Feb 18 15:53:01 +0000 2020,233905612,1,"Nope. Only the weakest people can't own up and admit fault, nor show any semblance of humility in the process. Donald Trump takes credit for everything and responsibility for nothing. The weakest man on earth is advising the homophobe to be just like him.",,
Tue Feb 18 15:53:01 +0000 2020,24410880,0,I think @nascar is gonna have to call in exorcists to rid that track of the evil jinx that @realDonaldTrump left behind. #DAYTONA500 #RyanNewnan @DISupdates,@nascar @realDonaldTrump @DISupdates,#DAYTONA500 #RyanNewnan
Tue Feb 18 15:53:01 +0000 2020,3074932775,0,"How's your new Gestapo, trump?",,
Tue Feb 18 15:53:01 +0000 2020,264270933,0,Don’t you have Google? C’mon.,,
Tue Feb 18 15:53:01 +0000 2020,820719114146746368,0,https://giphy.com/gifs/3oeHLie5cMkV6HNNPW/html5 …,,
Tue Feb 18 15:53:01 +0000 2020,953486742652313601,0,#FactsMatter @realDonaldTrump Insane! https://twitter.com/ElijahSchaffer/status/1229644173256454145 …,@realDonaldTrump,#FactsMatter
Tue Feb 18 15:53:01 +0000 2020,2534158202,0,"I know trump supporters don't care for actual facts, but here they are. Gallop polls. Although his approval rating did go up, it was nowhere near 61%. https://news.gallup.com/poll/284156/trump-job-approval-personal-best.aspx …",,
Tue Feb 18 15:53:01 +0000 2020,1220724863775789057,0,Stop & frisk was started by Rudy Giuliani & Mike kept it in an effort 2 reduce the 650 murders (most of which were male minority) a year in NYC. He took advice from many people from what he’s said. He did stop the process & when he lest office the murder rate was down to 300.,,
Tue Feb 18 15:53:01 +0000 2020,1185332816281767936,0,More what ifs? That seems to be your go to move what if.,,
Tue Feb 18 15:53:01 +0000 2020,1018996830900834310,0,pic.twitter.com/cVIwrXYcYZ,,
Tue Feb 18 15:53:01 +0000 2020,1172554086295556096,0,Where's your diaper??!,,
Tue Feb 18 15:53:00 +0000 2020,1270532702,0,busy on itself,,
Tue Feb 18 15:53:00 +0000 2020,763136752785555456,3,"""List of people granted executive clemency by Donald Trump"" Drug trafficking and fraud Racketeering Arson Assault and murder Murder Murder Etc.................. https://en.wikipedia.org/wiki/List_of_people_granted_executive_clemency_by_Donald_Trump …",,
Tue Feb 18 15:53:00 +0000 2020,1085092087320563712,0,"President Donald Trump falsely designated himself the “chief law-enforcement officer of the United States” on Tuesday. He also acknowledged that he makes AG William Barr’s job more difficult, referring to Barr’s remark that Trump’s tweets make it “impossible” to do his job. pic.twitter.com/SWC19CEktv",,
Tue Feb 18 15:53:00 +0000 2020,784956080799580160,0,My car has windows.,,
Tue Feb 18 15:53:00 +0000 2020,779088591406399488,0,#ILikeMike,,#ILikeMike
Tue Feb 18 15:53:00 +0000 2020,3169398883,0,Just got home a few ago & found out that @realDonaldTrump has been handing out pardons like they were under-aged pageant contestants. Is there any white-collar criminal he *hasn't* pardoned yet?,@realDonaldTrump,
Tue Feb 18 15:53:00 +0000 2020,856673749885607936,0,SKID MARK SHDJKHGSDK,,
Tue Feb 18 15:53:00 +0000 2020,3415715429,0,GND costs 91 Trillion are you insane. Not even bernie was willing to vote on that when it came on the floor.,,
Tue Feb 18 15:53:00 +0000 2020,34262462,33,"Soros says Facebook CEO, COO should be removed, accuses Zuckerberg of conspiring with Trump @georgesoros @realDonaldTrump @Facebookhttps://sptnkne.ws/ByqB",@georgesoros @realDonaldTrump @Facebookhttps,
Tue Feb 18 15:53:00 +0000 2020,342271007,0,i hope they burned the camera when they were done,,
Tue Feb 18 15:53:00 +0000 2020,3327512612,2,@rakendri57 I follow backMAGA KAG!!!,@rakendri57,
Tue Feb 18 15:52:59 +0000 2020,2762686217,3,Fire you? Why wouldn't they stand by you?!,,
Tue Feb 18 15:52:59 +0000 2020,464817963,0,Jealous?,,
Tue Feb 18 15:52:59 +0000 2020,979356390048202752,0,Not much diversity in those photos!,,
Tue Feb 18 15:52:59 +0000 2020,766878593007792128,4,Ignoring @GOP warnings to @realdonaldtrump about pardoning criminals convicted of exact corruption he campaigned against-Trump pardons 11 convicted criminals. All are well connected to this @potus convicted of same type of crimes Trump is hiding from Americans. #PardonTheSwamp,@GOP @realdonaldtrump @potus,#PardonTheSwamp
Tue Feb 18 15:52:59 +0000 2020,191993153,0,pic.twitter.com/BdmJeJOR2z,,
Tue Feb 18 15:52:59 +0000 2020,1005992873471463424,0,He’ll crush your lord and savior.,,
Tue Feb 18 15:52:59 +0000 2020,938317153,12,"As @realDonaldTrump commuted the prison sentence of former Illinois Gov. Rod Blagoevich, the @chicagotribune began pounding out its usual spit-out-your-coffee, riveting, comprehensive, unsurpassed array of news reports, photos, videos and graphics:https://bit.ly/2ufWDyg",@realDonaldTrump @chicagotribune,
Tue Feb 18 15:52:59 +0000 2020,2525872490,0,"@realDonaldTrump sir, I emailed you through white house asking a pardon for a felony charge I have on my record over 10 years ago for harassment and a crime I did not commit. Please contact me soon. Thanks.",@realDonaldTrump,
Tue Feb 18 15:52:58 +0000 2020,81107148,0,". @realDonaldTrump on @BPUnion: “We love our border patrol agents.” And @BPUnion loves @DarrellIssa, which is why they endorsed him! @carldemaio called these brave men and women “The Swamp” said they’re only interested in lining their own pockets. #MAGA #KAG #BuildTheWall #CA50https://twitter.com/WhiteHouse/status/1228458641658908672 …",@realDonaldTrump @BPUnion @BPUnion @DarrellIssa @carldemaio,#MAGA #KAG #BuildTheWall #CA50https
Tue Feb 18 15:52:58 +0000 2020,876900766295969792,0,Is that why they are rated #1 for cable news beating out CNN and MSNBC?,,#1
Tue Feb 18 15:52:58 +0000 2020,823339556699312130,0,Ешьте дерьмо,,
Tue Feb 18 15:52:58 +0000 2020,881363723582963712,0,Our Great President is going to Make America Great Again! RT @Freudjcd: RT @itsJeffTiedrich: @realDonaldTrump imagine being this proud of being this childish,@Freudjcd @itsJeffTiedrich @realDonaldTrump,
Tue Feb 18 15:52:58 +0000 2020,1150921507528331265,0,"When this tweet comes up in my feed, it won't let me like it. It says it was deleted. But here it is on yours still. Twatter in the tank for Mini Mike.",,
Tue Feb 18 15:52:58 +0000 2020,1199786591306301441,0,I'm a huge fan of yours and I'm reaching out to you with a crisis of global proportions. Deforestation of the Amazon needs to stop. Unchecked this will affect everyone.,,
Tue Feb 18 15:52:58 +0000 2020,872225829056655360,0,Federal judges can be Impeached.,,
Tue Feb 18 15:52:57 +0000 2020,36139257,0,@realDonaldTrump #MAGA #KAG2020https://twitter.com/RandyResist/status/1229914239349010433 …,@realDonaldTrump,#MAGA #KAG2020https
Tue Feb 18 15:52:57 +0000 2020,1146489324264804352,0,Let's get it done! Build the wall. Arrest and deport No amnesty No federal funds for sanctuary cities and states No free heath care or tuition for illegals Business that hire illegals lose business licenses #VoterIDNow,,#VoterIDNow
Tue Feb 18 15:52:57 +0000 2020,775801337791426560,4,"Hey People.. We can't allow this, True Blue Patriot/Whistle Blower, to be ostracized and punished; for sticking up for the welfare of our families/our children!",,
Tue Feb 18 15:52:57 +0000 2020,1904304318,0,"You a criminal and a fraud. Barr and you will both end up in prison. Counting down the days, can’t wait! How bout you? Getting nervous?",,
Tue Feb 18 15:52:57 +0000 2020,561835971,3,RUDY AMERICANS KNOW YOU ARE UNDER CRIMINAL INVESTIGATION YOU HAVE NO CREDIBILITY!,,
Tue Feb 18 15:52:57 +0000 2020,1149440010858270720,0,pic.twitter.com/dMrOKWmAHw,,
Tue Feb 18 15:52:56 +0000 2020,308257358,0,@KaivanShroff what oppo research is talking about. Speak up. We can’t hear you.,@KaivanShroff,
Tue Feb 18 15:52:56 +0000 2020,823392819033337856,0,"Rudy Giuliani, March 2019: “The president is not going to consider pardons. He’s not gonna give any pardons. Of course, he has the power to do it, but I have no reason to believe he’s going to use it.”",,
Tue Feb 18 15:52:56 +0000 2020,42670862,0,"Have those 175,000 only been in there for 3 years? Obama was In office for 8 years. Did he let them out? If @realDonaldTrump said jumping off buildings was bad for you, you and the Democrats would climb to the top of the tallest building and jump!!!!!",@realDonaldTrump,
Tue Feb 18 15:52:56 +0000 2020,1329407510,0,What is it with Trump supporters and facts? Do you really think your base is that stupid?,,
Tue Feb 18 15:52:56 +0000 2020,1134304210269474817,0,What a king,,
Tue Feb 18 15:52:56 +0000 2020,1189698919212703745,1,Awesome! Please do more of this! America needs to see what is really going on.,,
Tue Feb 18 15:52:56 +0000 2020,4872845318,0,pic.twitter.com/zImuWQXztk,,
Tue Feb 18 15:52:56 +0000 2020,17638030,0,There's one problem with that plan. (Hint: Trump is a massive racist.),,
Tue Feb 18 15:52:56 +0000 2020,1223730088254021637,0,Read the damn report on FISA abuse Jeff.,,
Tue Feb 18 15:52:56 +0000 2020,34948913,0,@realDonaldTrump Please help I am pin down in America which has been taken over by equatorial people who are bigoted and oppose the president and my tax losses. The president survived by three votes. Need my money,@realDonaldTrump,
Tue Feb 18 15:52:55 +0000 2020,3734000057,0,"Por que sera? que para los Uribistas este señor es su idolo, la difrencia es que en EEUU ya tenian sentencia, aca son idolos, estan libres y muchos los justifican y defienden.",,
Tue Feb 18 15:52:55 +0000 2020,1003038274380705792,0,"Look at that! Effortless cool. Haven’t seen that in the White House since January 19, 2017.",,
Tue Feb 18 15:52:55 +0000 2020,740980716603854851,0,"It’s not what happens when a Trump supporter visits campus, but rather, when a homophobic, transphobic, and racist antagonist visits a campus that they know they are not wanted at just to stir trouble.",,
Tue Feb 18 15:52:55 +0000 2020,3345957741,14,@realDonaldTrump look here Obama commenting on an ongoing case. https://twitter.com/Jali_Cat/status/1228510568056852482 …,@realDonaldTrump,
Tue Feb 18 15:52:55 +0000 2020,1202475766023426048,0,pic.twitter.com/z81i3ywf9I,,
Tue Feb 18 15:52:55 +0000 2020,16622169,0,Or this...pic.twitter.com/GNbxH3r7lj,,
Tue Feb 18 15:52:55 +0000 2020,977661337508765696,0,Perfect!,,
Tue Feb 18 15:52:55 +0000 2020,1161378960065945600,0,"Oh wow you're on twitter, some words of advice then. Don't go to public places with the intent to harass people with dumb and or offensive questions. Thanks~",,
Tue Feb 18 15:52:55 +0000 2020,1108020278,0,He's got good ads.,,
Tue Feb 18 15:52:55 +0000 2020,1938921966,0,Numb nuts sounds like he’s scared. Go Mike! @Mike2020,@Mike2020,
Tue Feb 18 15:52:55 +0000 2020,405160189,0,She can make the world a better place by stopping her public appearances which she willingly does to rile people up by harrasimg them and making ignorant comments on purpose and cause more problems. She's the cause of her own problems and the reason why people don't like her.,,
Tue Feb 18 15:52:54 +0000 2020,709933184608116739,0,Lol @realDonaldTrump will beat @PeteButtigieg as well. The @DNC is so full of themselves.,@realDonaldTrump @PeteButtigieg @DNC,
Tue Feb 18 15:52:54 +0000 2020,177706610,0,It has come up before but when all this other stuff became more important like the hoaxes and coup it quieted down. But he knows. I have no doubts this is get fixedpic.twitter.com/cv0GVIzQn2,,
Tue Feb 18 15:52:54 +0000 2020,226854313,0,"Wow! You are hilarious. Do you even care to have the slightest knowledge of reality? Your tweet is a wonder of sheer ignorance. I will leave your comment to horrified posterity. Feel free to continue making statements, they are amazing.",,
Tue Feb 18 15:52:54 +0000 2020,45627569,0,Family of One of the Felons @realDonaldTrump Pardoned Donated Hundreds of Thousands of Dollars to Trump Campaign: Report #MAGA #SwampRatshttps://www.thenewcivilrightsmovement.com/2020/02/family-of-one-of-the-felons-president-pardoned-donated-hundreds-of-thousands-of-dollars-to-trump-campaign-report/#.Xkx4opNY2K4.twitter …,@realDonaldTrump,#MAGA #SwampRatshttps #
Tue Feb 18 15:52:54 +0000 2020,45583209,0,OK tovarishch.,,
Tue Feb 18 15:52:53 +0000 2020,802760212964741121,0,i am so sorry you are facing all this garbage at a time in your life where you should be relaxing and enjoying your golden years. when were you fired? i can't find anything by googling. and why!,,
Tue Feb 18 15:52:53 +0000 2020,856958618251538432,0,You should know since you do the same thing.,,
Tue Feb 18 15:52:53 +0000 2020,958758594807177216,0,Sure it wasn’t because he was driving a Ford with a train horn?,,
Tue Feb 18 15:52:53 +0000 2020,898961030,0,How was she “harassing” people??? By having dialogue.... by not comforting them and telling them what they want to hear? If they didn’t like what she had to say they could of just walked away.....,,
Tue Feb 18 15:52:53 +0000 2020,968615323,0,You said that already today. Boring. #AlerttheDaycareStaff #DementedDonnie,,#AlerttheDaycareStaff #DementedDonnie
Tue Feb 18 15:52:53 +0000 2020,29599480,0,Donald Trump to waive Federal laws in order to speed up border wall construction http://americaswatchtower.com/2020/02/18/donald-trump-to-waive-federal-laws-in-order-to-speed-up-border-wall-construction/ …,,
Tue Feb 18 15:52:53 +0000 2020,1237664540,0,Badass over here,,
Tue Feb 18 15:52:53 +0000 2020,1165237227489767432,0,"look lady, I'm waiting for you to leave my twitter account alone- thanks",,
Tue Feb 18 15:52:53 +0000 2020,24238805,0,Anyone has a better track record than you do Spanky!,,
Tue Feb 18 15:52:53 +0000 2020,68825587,0,He is,,
Tue Feb 18 15:52:52 +0000 2020,26722264,0,"Yea, it has nothing to do with his tweet about training people to use their guns in case Bernie wins the election or other provocative tweets.",,
Tue Feb 18 15:52:52 +0000 2020,2865846678,0,Love it!! Ala Monty Python!!!,,
Tue Feb 18 15:52:52 +0000 2020,268863198,0,"Well, if nothing else, we are going to see what these judges are “made of” and whether or not they are prepared to stand up for the Rule of Law, or Not! @realDonaldTrump has forced them to either “stand up” or lie down!",@realDonaldTrump,
Tue Feb 18 15:52:52 +0000 2020,850327056495804416,0,Like you did to the senate only legal,,
Tue Feb 18 15:52:52 +0000 2020,3526334374,0,Should he win the Dem nomination you should Pat him on the head and rub his hair during the first debate.,,
Tue Feb 18 15:52:52 +0000 2020,2196079518,0,"...it's almost 3, in Moscow......time to shut the bot farm down?.....Comrade?....",,
Tue Feb 18 15:52:52 +0000 2020,191993153,2,pic.twitter.com/wJIhUuWPS0,,
Tue Feb 18 15:52:52 +0000 2020,1083807186382475267,1,Complete travesty of justice Free Ross Please !!!!https://freeross.org/about/,,
Tue Feb 18 15:52:52 +0000 2020,1671788659,0,"The civility on college campuses is foreshadowing the future 10 years. Prepare for war, it will come to a head. Scary shit...",,
Tue Feb 18 15:52:52 +0000 2020,24028558,0,"The courts and the military will get rid of him if he loses & refuses to leave. For the most part, the crts have been willing to rule against Trump & mil is proving to be pretty ind too. Voters must ensure that independence by voting Repubs out of the WH AND Congress in Nov.",,
Tue Feb 18 15:52:52 +0000 2020,698992648275804160,3,This is so emotional and so beautiful. God bless you Clinton Stewart. #FirstStepAct #KAG,,#FirstStepAct #KAG
Tue Feb 18 15:52:52 +0000 2020,960951529451614208,0,"Don't hold your breath. President Trump should have pardoned Roger Stone n General Flynn who both have been abused by the Corrupt DOJ/FBI n Unethical, Corrupt, Biased Prosecutors who had/have political agendas.",,
Tue Feb 18 15:52:52 +0000 2020,1702562120,0,"And after @realDonaldTrump hugs the boy as the kiddo asked, he turns to the father and says “you did a good job”.",@realDonaldTrump,
Tue Feb 18 15:52:52 +0000 2020,2164939065,0,I’m sorry who built your hotels and golf courses? Funny that it’s fine when it benefits you but when it doesn’t then you call them “illegal aliens”.,,
Tue Feb 18 15:52:52 +0000 2020,1090136488946356225,0,pic.twitter.com/aEg7o97RED,,
Tue Feb 18 15:52:51 +0000 2020,705416556650475521,0,"Illegal immigration refers to the migration of people into a country in violation of the immigration laws of that country, or the continued residence of people without the legal right to live in that country.",,
Tue Feb 18 15:52:51 +0000 2020,788090250383896576,0,Criminal friends should stay in jail!,,
Tue Feb 18 15:52:51 +0000 2020,4673876599,0,What about Putin?,,
Tue Feb 18 15:52:51 +0000 2020,1215848510664400896,0,The election being fair won't mean shit when all the Bernie voters stay home.,,
Tue Feb 18 15:52:51 +0000 2020,198996087,0,"Maybe the point has been missed. There are pedophile Rings around the world, & there are certain people trying to cover it up. Certain people are calling it a conspiracy yet they keep finding pedophiles Rings everywhere, interesting. Yes do some research.",,
Tue Feb 18 15:52:51 +0000 2020,975743704110690305,0,They will have to put him in cinter stage so it doesn’t look like it’s falling.,,
Tue Feb 18 15:52:51 +0000 2020,881363723582963712,0,"Our Great President is going to Make America Great Again! RT @AllieGallardo: RT @realDonaldTrump: Mini Mike. No, I would rather run against you!",@AllieGallardo @realDonaldTrump,
Tue Feb 18 15:52:51 +0000 2020,3144484716,0,"@jonathanvswan you’re pathetic! @BretBaier Mr “Fair, Balanced and Unafraid” but is anything but that when it comes to @realDonaldTrump and you to get on the bandwagon again. Trump has been treated unfairly for his whole term and neither of you have defended him. So go back to Oz!",@jonathanvswan @BretBaier @realDonaldTrump,
Tue Feb 18 15:52:51 +0000 2020,20197238,0,@SpeakerPelosi I cannot wait until the day that @realDonaldTrump can say your jailed for life! #JailedForLife,@SpeakerPelosi @realDonaldTrump,#JailedForLife
Tue Feb 18 15:52:51 +0000 2020,833745665809272832,0,#TrumpIsACarnivalBarkingClown,,#TrumpIsACarnivalBarkingClown
Tue Feb 18 15:52:50 +0000 2020,1153708119786082304,0,Sounds more like Nancy Pelosi,,
Tue Feb 18 15:52:50 +0000 2020,1090013259783069696,2,Until glorious re-election and you leftists start screeching in unison.,,
Tue Feb 18 15:52:50 +0000 2020,945342868255682560,0,Not going to happen anyway,,
Tue Feb 18 15:52:50 +0000 2020,1220728204450770951,0,"Why don’t you pay attention? He’s admitted on multiple occasions that in order to pay for his policies, he’ll be raising taxes on the middle class. Just because you’re not paying attention it doesn’t mean that normal, logical Americans aren’t.",,
Tue Feb 18 15:52:50 +0000 2020,455936584,8,"“I think it’s fair to say that with great power comes great responsibility and great consequences,” Judge Robinson said. “I think the damage caused by Mr. Kerik is in some ways immeasurable.”https://www.nytimes.com/2010/02/19/nyregion/19kerik.html …",,
Tue Feb 18 15:52:50 +0000 2020,766242758340280320,0,Does the jet stream move the virus.,,
Tue Feb 18 15:52:50 +0000 2020,69163209,0,Looks like he is trying to join the band KISS,,
Tue Feb 18 15:52:50 +0000 2020,1553668074,0,#Pardon @realDonaldTrump @gop #maga Make America Graft Again,@realDonaldTrump @gop,#Pardon #maga
Tue Feb 18 15:52:50 +0000 2020,593381402,0,@ScottMorrisonMP @realDonaldTrump #KeepThemOut Hello? https://twitter.com/PrisonPlanet/status/1229899801493475328 …,@ScottMorrisonMP @realDonaldTrump,#KeepThemOut
Tue Feb 18 15:52:50 +0000 2020,819791574724771841,1,"Yup, here comes the #TrumpTrain2020...pic.twitter.com/eftID5RrhK",,#TrumpTrain2020
Tue Feb 18 15:52:50 +0000 2020,20655524,0,You needed a golf cart for Taormina. You can't run.,,
Tue Feb 18 15:52:50 +0000 2020,163632330,0,Please explain.,,
Tue Feb 18 15:52:49 +0000 2020,575769943,0,"It does not matter what criminal activity @DNC are part of bc they never suffer a single consequence. @attorneygeneral @realDonaldTrump @GOP Taylor Act violation no prob if you’re a dem. If you’re Repbl, they’re bash your door in with machine guns drawn",@DNC @attorneygeneral @realDonaldTrump @GOP,
Tue Feb 18 15:52:49 +0000 2020,2381525436,0,"no, thats not mocking actually......disbelieving isnt mocking..nice try tho",,
